date,review,rating,isEdited,title,userName,developerResponse
04-06-2022 23:33,"This application is useless never works when I need to pay. Moreover, it never shows my total balance despite I tried changing the bank! They are just blaming banks whenever something went wrong from their side! It provides zero customer support. These people just play with the hard money that people earn!! SHAM ON YOU GUYS!!",1,FALSE,Useless app that scam,Jasz1897655,
19-02-2022 18:51,"Gpay is so bad, it’s so unreliable, every time I go to the store without any cash on me , Gpay always disappoints me ,sometimes its server down and etc, payment deducted but will be credited in your acc after 3working days ,man seriously!!! Give a better service, it’s really disappointing!!! Out of 10 , 6times I have difficulties in sending money .!! That’s a bad NUMBER Guys!!! Do something with it !!",1,FALSE,My expy,dissapointed soul(fix it),
17-07-2022 16:48,Google Pay is Not Working From Last 1 Week In Iphone 6s And IOS is updated with lastest version of 15.2.,5,FALSE,Not Working Of Google Pay In Iphone 6s,IamASingh0117,
30-12-2022 15:34,Is there an option to pay from Credit Cards with Gpay in iOS,4,FALSE,No option to map Credit Cards,Snohpla24,
04-07-2022 15:13,From last 15 days my google pay not at all working,5,FALSE,Not working,vishwanath gowda,
17-07-2022 04:31,"The 1st time I used this app, I loved it; and so much so that I have been using mainly this app for UPI payments since then. But lately the frequency of failed payments has increased. In the last week only I have faced 2-3 failed payments.",3,FALSE,Increased Frequency of Failed Payments,Rajat Girdhar,
02-07-2022 10:31,The worst app Compare to the other payment apps the Google pay payment is always stuck’s And the customer service is not good in this Google pay other apps are better than this google pay not install just go for Paytm or PhonePe is better don’t waste your money Gpay just stuck the money,1,FALSE,Every time payment stuck’s,CHALLARAKSHITH,
10-04-2022 16:06,"Please note this issue in this while I goona check balance by gpay its showing like couldn't check your balance like that it's showing so please try fix the issue by upcoming updates sir.

Thank to hear that",3,FALSE,Dear developers,periyanna,
12-03-2022 04:05,I am eagerly watching for update where you add apple watch support. But unfortunately you haven’t added Apple Watch support even in this update. Also there isn’t any option to add cards for ios users😕 kindly provide watch support in india😡,1,FALSE,Even this update have No option to add card and still no apple watch support. Reply me 😡,kingKetan,
06-03-2022 20:39,Please add a option for credit card bill payment too,4,FALSE,Adding options,Aratrika Purkait,
01-01-2022 14:26,"Google is world’s worst upi payment app. Always processing, failing to process and many issues. Since last many months I’m seeing the same issue not any implement. It’s looks like Google’s step product. 

Uninstalling today for forever.

Paytm is far better. PhonePe too better than Google Pay.",1,FALSE,The most stupid Google’s product,imshamail,
29-11-2022 12:43,Can google pay team plz confirm that you are block this app to iphone 6 and 6S also..??,5,FALSE,Google pay block in iphone 6 and 6S,Mohammad Anees Jambudiya,
02-11-2022 13:51,It would be more helpful if i could PIN some important / Recent people.  However i love the product.,5,FALSE,Add PIN feature,rajesh-donepudi,
21-10-2022 16:38,"When I’m travelling abroad I can’t transfer any tranjection to anyone so it’s an request pls make it gogglepay internationally . Thank you
It’s not work in Abroad",5,FALSE,Internationally pay,mammu hingu,
08-07-2022 15:22,Can i get 100 rupees loan because i lost to my girlfriend as i couldn't make her laugh in 30 seconds desperately in need of cash thank you,5,FALSE,Loan,kquaa,
14-06-2022 13:14,"Hi Team,
Please update the app so that the IOS user can also add their Credit card to the app. It is really inconvenient that the IOS user is unavailable to use this feature.",3,FALSE,Add Credit card option not available,Aryan1706,
20-04-2022 11:22,I have been complaining for past seven days but I still haven’t received my money back in my account. It has been debited from my account on April 13 but the transaction shows fail and the recipient also never received. All they say is it’s safe wait for 3 days but seems like I won’t get it back.,1,FALSE,Refund in my account,mexxxiaa,
14-04-2022 18:04,"It’s been like 3 years almost had done allot of transactions through Gpay and getting better luck next time in each and every scratch card i get , seriously I stopped paying through google pay now using paytm and they are giving cashback and vouchers every time !!! 
GG devs :)",1,FALSE,Getting Better luck next time for forever,JohnW33Ked,
12-02-2022 17:37,Kindly add credit card payment option on iPhone users,4,FALSE,To add credit card payment option,ab9.8,
30-01-2022 05:54,"For the last few months, the gpay never rewarded me. Always told that better luck next time.",4,FALSE,No rewards were given,smsshafeek,
18-01-2022 07:11,"It works fine with single sim but when we try to use for dual sim, it becomes annoyingly difficult to get started, this issue is only with Gpay compared to other UPI apps I use",3,FALSE,Doesn’t work smoothly for dual sim,rohant86@ios,
04-01-2022 12:50,"After clicking to activate my bank account it is taking directly to sms and drafting a message to an unknown number. Later I searched the number with true caller it showed spam. Kindly look into the matter, it’s getting difficult to work without the digital payment",1,FALSE,Unable to register to my bank account,NaazYasmin,
01-01-2022 13:45,Hey team why you do not introduce card add feature yet on google pay app please add this feature thats why i cut one star out of five,4,FALSE,Something missing,onkargill,
06-10-2022 10:37,Plse add new new animations while payments process for example when the payment is successful which gives it more fresh look and ease of use,4,FALSE,New animations,Nidhin's,
08-03-2022 14:13,Please give us updates in iOS for adding credit card and debit cards to use in Google pay,4,FALSE,Need upgrade for add credit and debit cards,sekc8,
11-08-2022 06:28,"This is a rubbish application, once you get the money, there is no responsible, three days time is given, and you keep on waiting for your peso, no matter how much request you have, better then phonepe which  Solve the problem immediately, I advise everyone not to use Google Pay.",1,FALSE,Too many transactions get stuck,Sadiq RaYeen,
16-07-2022 09:04,For the past few days I haven’t been able to make more than 2 payments as it shows transaction frequency limit reached.,3,FALSE,Transaction frequency limit problem,Giru129,
15-07-2022 11:08,"I have lost so much money while transaction in gpay once transaction failed money will debit from bank account and it will never come back to our bank account 
We have to keep reaching  them tell what happened leaving our all work 
I lost 1900/- never came back to me 
Guys be aware",1,FALSE,Worst service eating peoples money,vijaii raj,
12-07-2022 10:53,"I need to be able to disable the confirmation sound.

This app overrides the settings within my iPhone. 

I should be able to disable the sounds",3,FALSE,Confirmation sound,Aymen Elmardi,
27-04-2022 16:32,"Everytime I try to send money it shows ‘You’ve reached the bank limit to send money. Please try a different bank account’.
Even though I haven’t made any successful transactions in the past one month! How do I fix this issue?!!",2,FALSE,Not able to send money,nf6891,
23-12-2022 16:36,I have changed my mobile number in bank records and I have doing the same in the google pay it’s not getting done and the service team also is not supporting me it’s been more than Week.. many times I have contacted them but there is no solution..,1,FALSE,Worst service from customer support,Rajeshwara chary,
08-08-2022 16:30,"Hi! I have been using my Google pay account for 3-4 years. Today, suddenly it asked me to login again with my phone number and then it created a new account. And then asking me to add bank details. I don’t understand this. And I don’t find this sort of help in FAQs.",1,FALSE,I already have Google pay account but app is asking me to create,Chunnmunn,
04-06-2022 18:18,Final good bye to gpay. No help is provided by the gpay on any transactions. They will always ask u to contact ur bank for any disputed transactions. If I have to contact my bank for any disputed transaction then I would prefer the banks app for all my future transactions. So google pay u guys just pack ur bags and bug off from Indian market. Not at worth your precious payments and money.,1,FALSE,Pathetic app,nexttsunami,
09-04-2022 11:22,"Hi Guys,

Just wanted to know, by when do you plan to enable the add credit card function on your app for iPhone users. 

It would be a great feature to have.",3,FALSE,When will you add credit card option on apple,Maverick ind,
31-03-2022 09:18,"I’m using g pay since 3-4 years 
Now it’s showing that I need 13.4 iOS update. When my phone is in good condition why should I buy new iPhone series just to open this google pay ?? 
I’m not able to add bank  account 

Please solve this and make it available for all the version",1,FALSE,Make available to all versions of iOS,abhi@6998,
25-02-2022 08:09,"Initially this app worked like a charm. But lately, too many transactions are failing, and I am not getting visibility into refunds either. Seems very buggy. Now moving to another app.",3,FALSE,Too many failed transactions,Namraata,
25-02-2022 05:07,"Hello Team, 

When will credit card option shall come for IOS users? It will be helpful to maintain our expense track. 

Thanks",3,FALSE,Credit Card as payment option,Manoj_Bhardwaj,
19-12-2022 08:47,"My transaction has been showing failed but amount has been debited from my bank account and while i was trying to contact customer support team, I am unable to type/chat as keyboard is not popping up to type. Useless app",1,FALSE,Unable to write while contacting customer support team,Pradeep072,
30-07-2022 16:38,Let users add credit cards in payment methods.,5,FALSE,Credit card,Shaiq Raza,
08-08-2022 19:30,Google Pay is not working on iPhone 6S. Why? I understand that it should be blocked on iPhone 6 which has an old operating system but why to block it on iPhone 6S. I have latest operating system in my phone. I had to switch back to PayTM due to this. PayTM is also using UPI but it’s still working on my iPhone 6S. Please fix it asap.,1,FALSE,Not working on iPhone 6S,Harmeet Singh Ghotra,
01-04-2022 06:27,"Hello team,
Kindly add tap and pay option in iOS update",5,FALSE,Regarding card tap and pay option,gurpreeeee,
06-06-2022 16:50,Always showing error that daily amount has been exceeded Ben when I didn’t use it since a few days.,4,FALSE,Amount exceeded,Swetatiwari1508,
06-05-2022 15:42,This really concerns with the privacy of the user..there’s no need of enabling location access. we see apps like PhonePe and other UPI apps not asking location in order to allow payments but why does google need our location !!??,1,FALSE,Accessing location to allow payment while other UPI apps doesn’t ask…,RafiqShaix,
12-01-2022 05:41,I request you to stop giving scratch cards after transactions. If you not going to give any rewards then please don give any scratch cards. Its very irritating to keep scratching the cards only to read ‘better luck next time’. There are other platform at least they don't pretend this way.,1,FALSE,Reward fraud.,aourabh nandi,
08-01-2022 16:36,"Hi, I am unable to update my app from many months. It’s says to sign in to iTunes every time I hit update and verification failed no matter how many times I try. I even reset the password but to no avail",3,FALSE,Unable to update,inandu,
23-12-2022 07:41,Often account suspended there is no answer from google,5,FALSE,Vry Worst Service from google support,2022md 2022 mohamed,
06-12-2022 09:57,"Hi , I am not able to install google pay in iphone6s . So is there anyway to install google pay.",5,FALSE,Unable to install in iphone 6s,lipilipu,
16-11-2022 06:46,We (users) need customer care number to contact. We are very afraid of our transaction when it’s pending or debited,4,FALSE,Customer care number,Skande264,
04-12-2022 05:18,"U need to change the UI , it has become worse and I personally don’t feel to use it … other apps ui is way better than yours ..

If you guys are listening or reading this m, then do the changes in UI .. why don't you hire me for this of ur team is not able to do .. i will make sure it is best for every user",1,FALSE,UI,Ujjwal Sahoo,
20-09-2022 15:56,"Most of the times when I use the app, either the servers are down, app is not working properly or money is not credited.
The customer support is very unresponsive and issues takes days to even get a reply. Wouldn’t recommend",2,FALSE,Inconsistent at every corner,anish hegde 5,
12-11-2022 09:21,Please don’t use google pay for payment of bills or recharge. They will fail the transaction and will not respond for weeks. So there is a risk of missing the billing date. And if you don’t want to miss the bill date then you will end up paying twice. Gpay is free and pathetic. Switch to other UPI,1,FALSE,Don’t pay bills or recharge in Gpay,Sarath Jayavel,
24-10-2022 06:07,"When we scan through the scanner in iphone and open google pay to pay, payments are getting failed showing warning messages even if we pay to trusted vendors like hospitals, coffee shops, super markets, etc….",1,FALSE,Payments are failed in iphone while scanning through iPhone scanner,saikiran2495,
04-03-2022 07:30,Unable to find option to add credit in 13pro.,5,FALSE,How to add credit card,rocky6695,
14-09-2022 15:49,When will credit card payment support be available on IOS,3,FALSE,Credit card payment support,Ashish _12,
07-04-2022 08:57,G pay is fraud app.. my transaction is completed by.. 16 March.. trough my frnds nd amount is debited from her side.. Nd I don’t get any msg or amount.. nd when I open g pay.. I saw I get the msg transaction is completed paid.. but amount is not received nd today’s completed 20 days around nd .. no resolving my issue nd contact no concerns .. I m contacting g pay.. many times but no one helps me.. g pay is fraud.. app..,1,FALSE,Fraud,bycrzc,
08-02-2022 00:56,"More than 1 lakh not able to pay by Credit/Debit Card. For UPI it’s restricted that’s ok, please allow for cards. Now a days insurance premiums are more than 1 lakh so that is must now a days.",3,FALSE,More than 1 lakh not able to pay by Credit/Debit Card,Prad-iPhone,
05-02-2022 16:23,"All my UPI Payments will are being done by this app. It would be great if there is any expenses tracking in this app itself , other than using separate app",4,FALSE,Add Expenses Tracking,Harsha Vardhan M,
02-01-2022 10:34,"I’m not able to add my Credit card in Gpay as I not getting the option for the same.

Kindly help.",4,FALSE,Credit card - Issue,Tikan05,
06-11-2022 09:02,Please improve your server maintenance other than that everything is fine,4,FALSE,Server Issues,Tago 999,
13-12-2022 14:56,The stupid annoying sound every time I make a payment cannot be disabled or removed. No settings. No way to remove it from notifications.,2,FALSE,Annoying sound cannot be disabled,anandcp,
12-11-2022 14:08,"I’ve recently updated new mobile number on my bank account yet only this app refused to fetch my bank account since the day I’ve updated and remains the same hitherto. Furthermore, even the UI is stuttering each time when I open the app on my iPhone 14 Pro Max.

Fixes would be appreciated!",1,FALSE,Unable to Add Bank Account,Tales Nexus,
28-08-2022 04:12,Hi team my gpay not working properly can’t send and receive and can’t open bank balance please solve it,4,FALSE,Can’t check bank balance,bhuvisugu,
23-10-2022 05:15,I am facing payment problems since one week I called customer care to help me twice they cut the call during conversation and unavailable to solve my problem of payment. Sorry I will switch to another upi app,1,FALSE,Poor customer care service incompetent persons unable to solve the problems and non responsive,dr ibne Ahmad,
08-02-2022 04:27,"Hey, i just found out that on iOs devices we can not add credit cards/debit cards to make payments. Will that be changing?",4,FALSE,Adding Credit Card on Gapy,Vainatheya1097,
10-05-2022 01:42,Wish credit card was one of the payment methods on iOS app. When can we expect that to happen?,3,FALSE,Wish credit card was one of the payment methods,Ady@money,
25-03-2022 14:06,"Off late the approve to pay feature is not working. When I enter my upi Id at a merchant site, immediately the approve to pay feature should reflect in gpay app for 5 mins. That isn’t showing. I am on the verge of delisting this app",2,FALSE,Approve to pay feature not working,Bishwajoy,
27-08-2022 11:20,I can’t see gpay business app in App Store. Can u share the link to download gpay business app.,5,FALSE,Google pay business app,Mutha_vikas,
04-08-2022 08:49,No reason and iOS running on 13,5,FALSE,Suddenly stopped working,crazy about ihoje,
24-08-2022 15:22,"We face a lot of server down issues on this app ,in an emergency i always face a lot of problem ,when i check my money it always shows that right now the server is down worst app",2,FALSE,Google pay is worst in times of emergency,reehaH,
23-04-2022 11:30,I am receiving texts from my bank that I have received money from my knowns but when I saw my account balance it didn’t show the amounts that I have received but even on the app it is visible that I have received money from senders. Can’t understand what is this glitch! Please resolve it !!,1,FALSE,Can’t receive money sent to me,sri1308,
17-04-2022 13:18,"I know you guys hate iOS users but please understand we are also paying you with our data and location services. So kindly add the pay with debit and credit card feature on iOS.

Hopefully someone of note will read this!!

Thank you!",1,FALSE,Pay with card feature,arigup,
07-04-2022 13:57,Amount is debited from my account and no credited in Recepeint account. Google pay takes no initiative to solve the issue. Bank says to contact Google Pay. GP team says to contact Bank. Money is debited from bank. Google pay makes new rules for respective scenarios. Fraudulent Application. Highly not recommended,1,FALSE,Fraudent at Google Pay,HLTej,
01-02-2022 12:39,I have an axis bank ACE credit card which over cash back for bill payment through bill payment but in Apple there are no option to add card . It’s frustrating..,2,FALSE,ACE credit card not able to add,kustavch,
27-01-2022 14:03,Why there is no option to payment with credit cards 😫,3,FALSE,No option to add credit cards,chetan gargs,
13-05-2023 17:11,"I’m trying to receive payment from my friends & contacts through Google pay. When they initiate the payment with my mobile number, it always declined with message “transaction may be risky and cannot proceed”. It happened 3rd time in 2 months. I don’t have any issue while I’m sending to anyone or making all types of payments. Every time I have to uninstall and reinstall the app and authorise all banks accounts to receive the payment. Contacted customer care 3 times but no solution given to me till date and no one called me. Every time I get a mail from support team stating they have done investigations and I cannot do any transaction at this time for some reasons and the issue cannot be discussed with me. I have checked all the security settings and everything is fine. I don’t want to create one more email or mobile to configure and do the transactions. Please help me at the earliest. Thanks.",1,FALSE,Iamnagi79,Worst Customer Care and Payments Failed,
31-07-2023 14:48,"This is the worst ever UPI app I have used in my life. All the other apps that I have been using have the transaction success rate of 95%. But Google Pay has around 20% in my experience so far. Google pay takes approx 20-25 seconds per transaction(which eventually fails) that too on a really fast internet. On the other hand, rest of the UPI apps successfully transact within 5 second. Amongst, Paytm being the fastest and safest of all. Also, I have lost my money because of a glitch in Gpay. Neither bank or the Gpay team took the responsibility of the money that I lost. Like seriously, in Gpay one of my transactions was stuck on “Processing payment” for over a few months. Going forward, if the same issues continue, if the transaction time and failure rate doesn’t reduce, I would happily take a legal action on Gpay team for being so ignorant and irresponsible towards our money.",1,FALSE,Vivekanand Sawant,The worst UPI app ever,
05-05-2023 11:50,"Since Google pay came to india i have used it since launch. 
After so many days of usage, I have realised there are few changes which could be useful I believe. 
There should be an option to filter account wise transaction in the transaction history. This will be useful to all the users who have linked one or more account to Gpay. 
Also sometimes in rewards screen, the app gets stuck and it has to be closed and restarted.",5,FALSE,NesethP,A very good payment app with slight tweaks,
20-10-2023 17:15,"I have been using google pay since a long time and have loved doing transactions with it. But since last few months, while transferring money, it takes much longer time and then the money gets debited from my account but doesn’t get credited to the other person’s account. This is so frustrating as so much dependency has been developed on this app. Despite of using the app so often, this issue is so irritating. Most of the payments gets failed. Most of the times have to wait for money back till 7 business days.
I seriously hope the team looks into this critical bug and solve this ASAP.",2,FALSE,Ayushi Dadarwala,Application just keeps on loading,
04-02-2023 17:03,"Recently I made a transaction and I paid ₹150 using Gpay. My money got deducted and didn’t reach the vendor. I waited for 20 mins, but still not paid and status said processing. I paid him in cash and when I checked after an hour, the amount was deducted from my account as well.
I contacted customer support, they asked me file a return charge with bank or contact vendor, which obviously is not possible. Ghis was not the first time it happened, only this time I had a situation where I cannot contact the vendor back (because his shop is 30kms away from my home).
Such a stupid app, and the company don’t even own their mistake. It is a ridiculous app. I am not going to use it ever again.",1,FALSE,Saurav 0601,Unreliable app,
23-09-2023 03:33,"Writing this feedback to improve the app functionality when a new bank account is added in gpay, gpay suspends the entire gpay account for verification instead of you need to do the account verification just hold the newly added account until the verification is completed so that the user can continue with gpay payments, I have been facing this issue couple of times (1 time phone change and once I reinstalled the app) but takes a week for gpay backend team to reactivate the account back. Thanks to other payment apps which is available as alternative to gpay. Due to this issue and backend support delay made me to switch to other payment apps.",1,FALSE,Bilal-313,Improve Google pay functionality,
30-03-2023 18:30,"What rubbish now Google is doing with the user I don’t know few days back I was using Google pay and suddenly my Google pay stopped working and account suspended message is shown on screen without giving any message, Call, e-mail any notice and they are asking to fill a form for verification. I called to them on customer support they said the same to submit the form then I submitted including my PAN Card. Now it’s been around 1 week and I’m going on calling to them every time they start talking in a new way and say it will be done you will get update nothing is happened yet and I didn’t expect this from google pay. Very bad service 😡",1,FALSE,Anonymous@N,Making account suspend without notice,
28-02-2023 05:20,"They have a facility for autopay. Payment is made automatically whenever a demand is raised by the vendor. However if for some reason the auto payment fails, they provide a pay now option too. You can click on the pay now option and make the failed payment. But beware, in spite of the payment being made, the app considers the failed auto payment as pending, and will make the payment on its own. So you will end up paying twice for the same purchase. Google help will simply wash their hands off.",3,FALSE,Sh2ai,Half baked app,
15-01-2023 03:59,"Being a tech giant it is not at all accepted to make people pay from the card which is linked with their own phone number, there is no provision to add card for the people who are using ios. Why issuing credit cards to users from the app if there is no provision for ios. Why can't you make apps similar in both the os varients. With the magnitude of resources Google has it doesn't take much to develop app in ios, also it adds value to the company and revenue as well. This is not expected from a Google, apps like phonepe and free charge are very much user friendly unlike Google pay across platforms.",1,FALSE,summi619,No provision to add cards for payments in Google pay,
