date,review,rating,isEdited,title,userName,developerResponse
22-11-2017 17:06,"Hi,

First of all, i did not expect such a Pathetic app from ""Google"". and afcourse if you thought service from google would be class apart--> believe me its all fake.
Nobody addressess your concerns. Like the rest of the buisnessess Tez support also plays blame game with you. not to forget, their technical representative will
try to charm by the standard line "" sorry for the incoonvinience caused"". I am avid user of banking apps. let me tell you home banking apps are the best.
By the way TEZ does not know where the money lays if transaction fails(afcourse transaction failure is very common). When you call TEZ tech support they will 
redirect you to your refistered bank and provide you the contact number of the bank too. let also put some light on this, When i tried connecting to the  provided contact number of bank,
turns out the number do not exist. Seriously, can you guys not confirm before providing the correct information. By the way ill specify my registered bank with the app is HDFC.
Is it so difficult to provide correct number?
I made a transaction on 8th November and i still do not have the clarity to know where the money is, leave about getting it back.

As per the APP it says ""MONEY DEPOSITED IN RECIPIENTS BANK"". where di you pull this information from. Why is you contomer service representative not ready to confirm on the same.

Ultimately DISAPPOINTED WITH tez AND google",1,FALSE,Pathetic app,rottenblade397,
10-11-2017 05:25,"InShort: Your own money may get stuck for 60 days and you won’t be even able to report problem before 3 days. Worst support.
    Read In full:

I tend to use lots of payments app and always remain open minded when using them. Be it PhonePe, BHim, Chillr etc.. 
However Tez looks to have the most Un QC’d app of all of them. Now if this was a game or simple app which helps you in managing your phone then it would have been a different thing, but it’s our money Tez is playing with. 
I had a failure of ₹500+ once, talked with their customer support and I was assured the matter will be taken care off.
I had a 3 Times failure of money transfer since then. Now here is the real frustrating thing.. the “problem reporting” to Tez option of a “failed transfer” opens after 3 days. The money gets deducted immediately and I am waiting to get back my money for over a week. As per Tez this can take up to 60 days.
Update: 17 days down the line, I have not received and I do have 2 other friends whose money got stuck as well, BEWARE if you can.

Honestly I did not expect this from Google, I will have to report this to NPCI and earnestly hope that this app gets pulled off unless they make it reliable. Don’t play with our hard earned money.",1,FALSE,"Highly Buggy and unreliable app, save your time and money",Sajalb,
03-10-2017 17:14,"I totally would recommend this app for all the UPI users. I’ve been using UPI from the start, and I’ve used these other apps they are good but not as great as TEZ. First off the design is very simple and everyone can easily figure out how to use it the first time. I just wish if there was an option to check our bank account balance in the menu page itself rather than having go through 2-3 steps, if that’s added it’ll be much simpler to view bank balance directly from main page.",5,FALSE,Simple and great,ashu gupta,
18-11-2017 14:58,"Tez is not reliable. The money does not get credited to the receiver’s account. However, the sender’s account get debited. There is no process to get back the money into the sender’s account. We had done the transaction in full operator network mode. This has to be rectified ASAP otherwise, there is no point using Tez. Is there a process to escalate such transactions?  Request team to look into the issue and resolve ASAP. 

Thanks",5,FALSE,Money does not get credited in the receiver’s account,audittime,
22-09-2017 19:20,"The app is much slower than BHIM, PhonePe and other apps. It does fail in link and finding accounts many at times but that can definitely be improved over time. Cant judge so early since it been not even a week since it launch. 

The app’s cash mode is a unique innovation and seems like it will go a long way. By the way, cash mode, takes way longer than it should to work buy definitely works. 

The app has very high potential to take over the upcoming and existing markets.

With its referral offers and other schemes. It makes it even a more joyful experience.

It still has a long way to go before I can use it as much I use BHIM. Good job though google, keep working on it and I’m sure you will be there.",5,FALSE,Good but can improve,Diveshp747,
10-11-2017 08:35,"Very poor support 

I have issue with one of the payments I made. Money is debited from my account but is not credited to the person i intended to send. Neither have I received my money back 🙁 I tried contacting tez customer service, they just call you back and put you in wait list. No one ever responds. Wrote a mail and yet no response. If this is the way the app support works then it really scares me 😟 what if that payment was urgent??? It’s been 5 days now and I am stuck with no one to ask help for. I will never do any payment via Tez and will not recommend others too.",1,FALSE,Payment issue since 5 days!!,sahana naik,
18-09-2017 18:56,Otp verification took long. Had to try twice to get it to work. But adding the Icici bank account seems to really not work at all. Tried multiple times with many messages sent. No response. Will review it once everything is working again.,5,FALSE,Doesn't seem to support Icici bank at the moment,Abhay R K,"{'id': 1294246, 'body': ""Hi Abhay: sorry to hear that your experience adding an ICICI bank account didn't work well. We're seeing some issues due to higher-than-expected traffic. We're working towards a fix and appreciate your patience!"", 'modified': '2017-09-19T04:11:07Z'}"
18-09-2017 10:03,"This is best payment app, it has everything Scan and Pay, Through UPI Address, Through Bank Account and best of all Sound Wave Payment 👏🏻

My only concern is, please let us choose our own UPI Address because UPI Address you're assigning are our Email Addresses and it'll flood spam mails if we keep giving it to everyone.",5,FALSE,Great App for Payment,Sabya Majumdar,
19-09-2017 12:55,"Interface is quite new for the people who are used to PayTm stuff. Once start using it's way ahead than PayTm or any other UPI app for the matter of fact. All banks apps are integrated within the UI which talks to many things at a time to make transactions happen which adds more n more layers resulting frustration in simple payment stuff.

Pros: 
Simple UI
Advanced Tech
Google's Security
Direct Account Bank Credit 
Free of Charge (no charges) at all

Cons:
Still trying to figure out, nothing much found so far.

Note: Just try to get used to the new interface it's little overwhelmingly simple.",5,FALSE,Awesome!! Simple!!,Sr. Dev,
22-09-2017 10:06,The app works perfectly okay. Its a brilliant app. India will probably move towards a more cashless transaction dominant future with the help of this app. The cash mode is simply brilliant! Google’s security is reliable and hence i took the initiative to use the app myself and encourage people around me to use it too!,5,FALSE,Great app! A must have for all indians!,Arnab Sinha,
18-09-2017 12:26,"I have been using the BHIM app for a while now but decided to try this one since it is from Google.

Simple, clean, usable interface as expected. Already did a transaction within 10 minutes of downloading it. Seamless app",5,FALSE,Tez - simple and does what it needs to do,iamShishir,
24-09-2017 12:30,"This application is firstly so slow, whenever we try adding the account, it keeps on trying and after trying about 7 times it adds the account. After that after adding, the transactions fail so many times, and for me it's still failing.
Secondly, the referral policy , I referred my friend I dint get the money till the time I send the feedback and my friend has still not get a penny. Then the rewards which need to added to the account are still not added. Poor application.",1,FALSE,Unsatisfactory,Upasana Nagpal,"{'id': 1341760, 'body': ""Thank you for being an early user of Tez, and so sorry to hear about the issues you've run into.  Let's connect you with our specialist team, available 24x7 to help ensure that Tez works for you! Fill out this form to request a call back: goo.gl/oPsfjI"", 'modified': '2017-09-24T22:36:48Z'}"
20-09-2017 02:38,"I’m unable to use my HDFC account with this app, though I’ve encountered no problem with my SBI account.

Also, the UI is a bit unintuitive. For example, calling the wireless money transfer feature “cash mode” is rather disingenious and unnecessarily misleading. With the nationwide push for a “cashless economy”, equating new and efficient contact-less money transfers with traditional physical cash transactions will be confusing to many people. Just name it for what it really is instead of using a literary equivalent of skeumorphism.",1,FALSE,Cannot link my HDFC account,tetea_t,"{'id': 1309022, 'body': ""Hey tetea_t, thanks for taking the time to review the app and so sorry to hear about your issues. We've taken note of your suggestions, and if you still face issues with adding your bank you can find troubleshooting steps at goo.gl/Aq8hBh Also feel free to contribute to the Tez community and share more of your feedback,\nThanks again for reviewing the app and appreciate your patience as an early user!"", 'modified': '2017-09-20T11:20:15Z'}"
26-12-2017 05:09,"In case the server went wrong by banks or some bad servers like SBI, the money reverts back within 2 business days. Great customer response too! 
The saddest part is I never received any of the money from scratch card from last 40 transactions or 8 weeks 😒",5,FALSE,Easy to transact and secured app,Abhinandan_S,
22-10-2017 09:22,"Money got deducted from bank and not transferred, but still not response from developer. It shows waiting from bank and will response in 48 hours. Please resolve the issue ASAP. Tried contacting through email but no response.",5,FALSE,Money got deducted from bank,Anubhav2786,
14-12-2017 18:02,"I lost my all transaction history after updating it on ios 11 , i never expect this kind of issue from google,because transaction history is must when anyone deals with money.",5,FALSE,Erased all histories after update,nikhilpawar,
09-12-2017 15:17,This app is very user friendly. Sending money to any one is as easy as chatting in WhatsApp. This app should be there in smartphone of every Indian citizen. Government should invest in advertising and promoting app like these if they want to push digital and cashless transactions.,5,FALSE,A very user friendly and efficient app,SagarCR,
19-10-2017 04:34,I made my first transaction and it worked fine and got the 51 cash back also. But after that I tried for many transactions and not even one transaction worked. Every transaction is failing.,5,FALSE,All my transactions are failing continuously.,DSujay,
20-12-2017 10:24,Receiving same notification for an offer to buy gift card again and again in every 10 minutes and there is no option in app to turn notifications off for these offers. I don’t want to turn off notifications from iOS settings as then I won’t get notifications when I receive money. Fix it people!!!,2,FALSE,Receiving notification again and again,Atin Singhal,
22-09-2017 09:59,"The app is really helpful and fast in sending money to friends.
The nearby sharing feature is one of the best. The payment system sometimes gets hang and shows error at times. As an overall review, the app is really helpful.",5,FALSE,Very good app,Dhipin K Das,
16-10-2017 07:08,"The app worked very well for the first week, but now I am unable to send money from my account it keeps showing the error that unable to reach bank servers, I am facing the problem for last 3 days. 
And to see whether the problem is in all upi based apps I tried sending money via BHIM app and there the money got transferred. So the conclusion is ryt now google need to correct the problems in this app",2,FALSE,Keep showing errors,leonscannidy,
21-11-2017 04:51,It's been more than 40 days since my last reward money but many of my friends and family friends who received rewards money. I felt it's biased and no reason why I haven't getting rewards anymore.,5,FALSE,Bad app. Reward program is fake,Gokularkishnan Mohan,
21-09-2017 03:44,"Unable to add my PNB bank account even after multiple tries and messages sent . 
Please fix this issue asap. 
Will update my review when fixed.

The app otherwise looks very promising though 👌🏼",5,FALSE,Bank account aading not working,Hims4,
04-11-2017 03:33,"I am a TEZ user. This app really takes a very long time to complete every transaction where as in different apps like phone pay is really fast for such things.

Sometimes when transaction goes wrong then no-one answers your queries and even the customer care is not reachable. One of my transaction of 540 went wrong and debited from my account but in tez the transaction is showing as failed.
I several times tried to resolve this but nobody from google is reachable.",1,FALSE,Asish Kumar Satpathy,Asish satpathy,
31-10-2017 06:43,I made a tranfer of amount 8000 rupees but beneficiary did not receive the amount and I also did not receive amount . If I try to contact customer care no one is picking call . Chat option also disabled .,5,FALSE,Amount not received yet,Ezhilarasan111,
25-10-2017 03:16,Thanks Tez team and Google..you are giving money for my daily expenses.. in a weekly basis.. till now i have earned 890/- rupees only.. but that money which i have earned is giving some support in my monthly expenses ..Once again thanks for supporting poor people(like us).🙏🙏,5,FALSE,Thanks Tez!!!!,Thanks Tez Team,
19-09-2017 12:01,It's really nice app by Google. It's also user friendly. You can easily send and receive money directly into your linked bank account with this app.  There are many rewards and offers available.,5,FALSE,Amazing app by Google!!!,$@gar Nathe,
17-11-2017 04:30,"A financial transaction is supposed to be atomic — either it happens successfully, or it’s reversed. That is not the case with Google Tez.

I had two failed transactions of 30k and 29k. Money debited from my account but not credited to the beneficiary. It took over three days before I could get the money back, and that too after going into the app and raising a dispute.
 
Support is not Google’s forte. I don't know what they mean by 24/7 support -- I was never able to reach a human.

Use this app in its present form if you are ok to risk letting your money disappear into thin air for a few days.

They marketed the hell out of this app with cashbacks, offers and what not, but the app doesn’t succeed in gaining my trust.

Will they respond to this app review? I doubt it.",1,FALSE,Money disappearing like jadoo!,no-malice,
15-10-2017 05:26,"Not yet received the scratch card amount still in processing it's been 6 days
Also many of the transactions done by my family members showing status waiting for bank and money is deducted from account, I complained tez team but still issue is not solved and I don't know how long will they take",3,FALSE,Gud app but sometimes transaction get stucked,Nykz24,
18-10-2017 13:40,"First of all, the user interface is very simple that even a kid can understand all the features. The app features work as described and correctly. Bank transfers are very easy using this app.",5,FALSE,Awesome app with easy to use interface!,gonelifedie,
18-11-2017 10:51,"I am not able to add icici or sbi bank account. Google helpline also failed to resolve the problem. They say it’s the problem of bank and bank says its problem in Tez App.

I tried to get help from Tez call centre but could not get the solution till date.",4,FALSE,Unable to register bank account,Rajesh Saxena,
24-12-2017 13:17,Am not able to add my bank account details to te app. When am giving add account it is sometime hanging or getting closed. Please fix this issue. Am an iphone 5s user. Please fix this issue.,5,FALSE,The app is crashing automatically,Ashikpa007,
20-11-2017 09:33,"Initially Tez started paying out on bank accounts, people misused this for getting scratch cards and tez used to pay back. But when people are accustomed to this app and making genuine payments Google analytics is playing with us and giving no luck. Hence I've decided to switch back to my bank app for payment. 

FYI Tez isn't always good money is stuck in most of the times. This app was a huge for quiet some time",1,FALSE,My personal view on Tez app after 2 months,Jr.rafa,
04-12-2017 14:21,I have two accounts linked to same number so app dose not show any of my accounts . While BHIM App shows both accounts for transactions so that I can select any of one account for  transaction,5,FALSE,Sorry google,Suhas_bn,
18-09-2017 12:22,Heard about this app and decided to download it. It's got a very small footprint - just 7mb. The app installed quickly and I sent my first transfer out in minutes. This is an easy app to use - love it!,5,FALSE,Simple App - Intuitive and easy to use,Ashish Kole,
20-11-2017 09:58,A transaction of ₹173 dated 13-Nov-2017 which was deducted from my bank account did not credited toh the reciever’s account nor it was refunded until now and a transaction of ₹200 which was deducted from my account today but was not credited to the reciever’s account as well nor it reflected back . Worst payments app until now which i’ve used . If you want to save your money please don’t use this app.,1,FALSE,Worst App Ever . If you want to save your money use phone pe aur any other secure app,Kumarrjayant,
16-11-2017 04:11,No failed transaction no bugs or issue which has on other upi apps i have used before !! Flawless the only option was need support !!! Otherwise its was just perfect the referral and its really Tez! Keepit up Google !!!!!!,5,FALSE,Tez ! Too fast,@ngryBird0,
30-12-2017 10:41,"This app is fraud because in starting when you install this app . It gives some rupees in every scratch coupon like 20-25 etc. But after some time it doesn’t give you money it’s showing “better luck next time”.
Because i done last 20-30 transaction but it shows always this msg never give money. So don’t download it. Because we refer this app with over friends Tez gets befits from more user . Totally we make a fool .",1,FALSE,Fraud app,Ramsusi,
26-09-2017 02:42,"My money debited but received didn’t get it. Over the top of it, when I requested a callback, they put me on hold for more than 20 minuets. I am still waiting for them to pick up the call. Pathetic services. Disappointed. Wasn’t expected from google.",4,FALSE,Worst app,Mirchiasdf,"{'id': 1378704, 'body': 'Hey there so sorry for the inconvenience. In cases like this your bank will reverse the charges in a few days. If it does not happen, please do raise a dispute through the app so that we can rectify it asap. Thank you for your patience and the report!', 'modified': '2017-09-28T03:52:41Z'}"
18-11-2017 13:02,I am not able to enter the pin and go to the main page of the app. Everytime it crashes seems the app has some updating and bug fix needed,5,FALSE,App crashes,Parth Gala,
18-12-2017 16:25,In recent updates on iOS u can’t see in the history box of a person that who has sent this money instead u have to open transaction history to find out who has sent u money. Please fix the bug and update the app asap. Also in uber ios app tez pay isn’t included in payment option. Please include it,2,FALSE,New update has a lot to fix.,rush_raj,
17-11-2017 13:53,"Tried twice, paying at reliance market with bharat QR using Tez app. 
Money debited from my bank account both the times but not credited to reliance.

Still waiting after 7 days and no resolution yet.",5,FALSE,Money debited but not credited to Reliance market store,5hashank,
18-09-2017 20:08,"Google yet again back with its mesmerising product .thank you google for making it and please continue such useful product for us in future 
Thanks",5,FALSE,Awesome product,leader-singh,
10-10-2017 09:51,My friend have send me money through this App and transaction got successful but after that when I check my statement in bank account I haven't received that money which she has send. Very bad service,4,FALSE,Payment successful but not Received money in account,Vipin 4s,
03-10-2017 06:17,Very reliable & convenient. I can use it every where any time which is most important according to me. I recommend it mostly to every Indian. Thanks for making such an app for us.,5,FALSE,Super fast & secured,Soumen Bhaumik,
06-10-2017 14:50,"Hello,
This is an amazing app, but recently I sent some amount to a friend of mine, It got debited from my bank account but my friend did not receive the amount. It is stuck on waiting for bank in the app since a very long. Please look into this issue as soon as possible and revert the payment at the earliest.
Thankyou!",2,FALSE,Amount debited from my account but receiver has not yet received,Abhijeet Wani,
19-11-2017 19:14,Don’t try it my payment is stuck from past 20 days and i made a dispute the dispute is still in progress and hasn’t been clear,5,FALSE,Payment stuck,Htaneja2,
18-09-2017 02:01,"Hi guys,

It's an honest feedback from me. This app is just amazing and the features are like awesome in this. It's too fast in making the payments via UPI.

Thanks Google for such a great product to India to make India a digital payment world.",5,FALSE,Tez - A great payment app never ever in India,$waroop,
25-05-2018 10:08,"first of all dint expect an app like this from google.

I started using this app and all of a sudden it got suspended when i tried to link my bank account. Customer rep said u have to submit govt proof I submitted aadhar it was rejected saying this proof is not accepted who the hell dont accept aadhar everywhere its aadhar in india. Again i submitted my pan then they released my suspended account and when this time again i tried to add the bank account it worked for one bank when i tried to add another bank I unknowingly keyed in wrong credentials to which again my account got suspended. come on is this the way u handle things when credentials are not correct rather than showing an error message why the heck do u suspend the whole account. This is the 6th time in a row that happened. Utter nonsense app dint expect this kind of process from tech giant google. I have been using phonepe it works like a charm the way they handle things is way more userfriendly and better than this app. Even the govt run app BHIM does way better than this.",1,FALSE,Pathetic app !,taha4u2,
01-10-2018 06:03,"I paid bsnl bill with google pay. Money got debited from my bank account but bsnl says they never received the bill. due date crossed and bsnl forcing to pay bill or cut off connection. i had provided all tx ids to bsnl but they confirmed that they did not recieve amount. 

Now real thing, you will say contact google pay. I did.   Customer says - no bsnl ko payment nhi mila honga.  (exactly same language). we only hold 50% responsibility.  Third class google, what do you mean by 50% responsibility?.   If bsnl says why Google and Bsnl settle this internally ? Then i raised dispute. i was told dispute will get addreses mx before 1 oct. Today upon calling getting arrogant response from google pay. He says terms n condition padha hai. padho. 7 working days means 2nd oct. Call us by then. bar bar call mat karo. Yes exactly this is the word. i am not exaggerating.  is this the way to talk. you are third class. i request everyone to rate 1 star for such third class attitude.",1,FALSE,"Never use Google Pay , you lose money",Ordinary developer,
03-09-2018 17:45,"Its really very easy to use. With hasselfree transactions. I have stopped using net banking after I installed this app. Linking bank account too quick and easy, just few steps and I am done. I referred this app to many of my friends and they all use this app for their transactions regularly. Its very quick. The most amazing part is the reward we get as scratch cards for every transactions and its get credited in my account. Getting money for sending money. Its it cool. Yes sometimes it takes time to process because of sever issues. But then its fine. If you try sending after sometime it works fine. I am happy and this is the best ever app for sending and receiving money.",5,FALSE,Amazing app,Akanksha Sarkar,
09-07-2018 10:54,"Like everyone was using Tez app even i downloaded it. I sent money it was smooth like any other app but worst thing happened when i tried to pay my electricity bill through this app. I paid my bill on 16th june the transaction got failed and money was deducted from my bank. It said money will come back in 3-4 days. No money was refunded. I called customer support he assured me money will be back in a week but no money was refunded. After long time one of lady asked me to mark as dispute i did it but when i asked her when it will be resolved she said “ no idea but soon” .I called customer care many times and had a chat with them but no solution. Some of them will gurantee you but u will see no money . It’s been almost 26 days they say it’s been escalated to higher authority and i see higher authority dumb as they are. I don’t think they will refund my money. Don’t USE THIS APP. WORST APP, SCAMMERS!!",1,FALSE,scamming app,Rbzzzzxxx,
