date,review,rating,isEdited,title,userName,developerResponse
10-09-2020 15:42,"Hi team, I have a Zero bill amount for Vodafone. So when I am trying to play in advance the app crashes. Please test it. My phone is iPhone 6s plus ios 13.7.",5,FALSE,Bug when bill pay amount is Zero,AnuragParmar,
28-08-2020 08:38,I have been using it for about two years but so far I have not been able to recharge even better,5,FALSE,This is an application that cannot be recharged,jafar shareef,
05-06-2020 22:29,Best app for transfering money and the rewards it gives its good it dosenf give all the time but once i got rs884 reward for sending 1000 rs which helped me so i suggest all of you google pay is the best app to make payments .,5,FALSE,Rewards,Dipesh Gautam,
23-05-2020 11:35,I recently updated the app.. but its not either opening after being updated,5,FALSE,App not working after updation,rupali22,
06-03-2020 05:33,Use phone pay because always better luck luck,5,FALSE,It’s not a good app guys ..use phone pay because always better luck luck,antony rko,
21-02-2020 17:18,Not receiving otp on my phone. Since i have been trying it from past 3 weeks. Please resolve the issue as soon as possible.,5,FALSE,Issue,acheulkar,
03-02-2020 16:19,My version of iOS is 12.4 but also it’s not working since last few days,5,FALSE,Not working in iPhone 6,viveknair,
27-01-2020 06:44,I m facing problems while using google pay on iphone 6 and 6s and i have tried changing bank accounts also but still not activating UPI. Sort it out so that i can use it wisely.,5,FALSE,Not activating UPI for iphone 6,kathuria princeeee,
30-01-2020 07:48,"Team,
I have been trying to add my bank account to Google Pay but every time it ask if my mobile number is registered with bank account. I have also check with my bank of there is any issue from their end but everything seems fine. It’s been a long time this issue has been happening and I am not able to use Googlw Pay, kindly help.",1,FALSE,Not able to add bank account,Abhi Varrier,
26-01-2020 14:57,I have been using google pay for a long time. It makes payment very easy and helpful but from past 6 months i have facing issue on making transaction from my bank through google pay. Server issue from bank . Its really annoying and when i needed to make some transaction it gives error. I hope google will fix this error. I have a sbi account.,1,FALSE,Not useful when needed,Ammu bhatt,
02-01-2020 03:39,only in google pay the rewards are directly send in your bank account so must try this app once u try after that you can’t delete this app,5,FALSE,I love 💕 rewards,Ansilin kumar,
15-12-2020 04:13,"After update its start behaving ad normal 
It’s closed automatically while application is in use 
Please resolve this immediately",5,FALSE,After update,binaaz,
25-12-2020 16:37,"I’m not able to activate my bank account due to an error stating that UPI transfer requires IOS version 13.4 or greater. I don’t understand why this compatibility issue has suddenly appeared though it seemed to work until today morning. 
Please look into this matter and would request it to be resolved by the next update.
Thank you.",2,FALSE,IPhone 6/6S UPI Issue,8.95E+12,
11-11-2020 13:22,"Had been using this app for quite some time now. Initially it was working good but these days I guess since past 2 months every payment is getting failed and money gets deducted from the bank account and it takes a while to refund. 

Guys can u even handle this....??

And forget about cash back it’s a scam totally.",2,FALSE,Useful but not helpful,Pawade A,
14-12-2020 12:00,"After new UI update and one color theme for all google apps the google pay app is so so slow that it takes literally 2-3 min just to open the app n that too on latest iOS and Apple phone.

The app is slow plus crashing all the time. What's the point of UI and color theme update, when the basic functionality of app is not working.

Worst update",1,FALSE,worst update- Too slow and crashes continuously,Dev@4890,
07-12-2020 18:04,"I am user of this app since Tez days , I don’t know what happened to you guys these days ? Not only for me even my friends are having trouble with your app a lot. I cannot able to book train tickets nor send money to my parents . Is this really a Google product ? Sometimes I need to think of it . Team please wake up and fix this issue .",1,FALSE,Disappointed,rojiesh,
04-12-2020 04:14,"SHAME, The app isn’t reliable. Money gets deducted from bank however it shows as failed in the app. I got debited twice because of the MIS information on the GP chart. I am yet to get back my money. Then vendor says he received money only once while it got deducted twice from my account. Trying to contact customer care, however not able to since more than a week. 

Call centre doesn’t answer so does messenger. SHAME",1,FALSE,UNRELIABLE,Shashimiriyala1234543219,
08-11-2020 04:40,"I did a mistake by upgrading the Google Pay app because after the update I am unable to use the app as I am using iPhone 6 and it wants me to buy higher version of device. Apple needs to correct this mistake some people can’t afford higher version of IOS device and at lest give the option to upgrade itself in iPhone 6,5,5s",1,FALSE,Needs to be correct this,Vickey220,
19-08-2020 04:35,Prior to having google pay are used to miss my bill payment dates and I have paid fine for late payment on various occasions but now I am a at ease,5,FALSE,Happy customer,ek Omkar,
14-09-2020 21:05,"Whenever I tried to process the payment through Google Pay, it always shows the same error “please try again later, server issue, unknown error”. Post updating the app there is no changes in the errors. Very very very less time we get the rewards for our transactions. 
I think this app is there in the market because of Google and nothing else.",1,FALSE,Lots of Errors in Google Pay,Kotak Staff,
21-08-2020 06:24,"It was perfectly working until one day when it asked me to recover my bank accounts. So I clicked on it and I received a message saying that internet connection is required although the device is connected to the internet. Now the app is completely unusable because of this. I have seen the same issue on my mother’s iPhone xr.
The device I am using is iPhone xs max.
Please fix this issue.",1,FALSE,Not working,ÂkHïŁ,
21-07-2020 05:58,"This is the good and quick way to payment option 
Good experience with all payment",5,FALSE,Good and quick payment option,Bhaskar P Patel,
18-07-2020 10:46,It’s fantastic to pay and hassle free particularly in iOS platform. I had only one problem when it could not connect my bank once. Otherwise it’s okay.,5,FALSE,Good and Easy,SGopinath1,
26-02-2020 11:01,it’s Pretty fine for usage Still needs to fix some sort of bugs during transactions like when we enter our UPI for Approval Apparently Hanging for a Sec it leads Slow in process,5,FALSE,Splendid,Isurenprasanna,
27-06-2020 03:54,9 out of 10 scratch cards says better luck next time. 10th card will give you 5₹. Then there are issues with payment failing and late refunds. You need to check these issues.,4,FALSE,Better luck next time,JLathwal,
28-04-2020 08:49,"Google pay as an media assisting user to make transactions simplified does not work that great to bio lines.
Especially transactions made showing as ‘processing’ even after 4-5 working days.
Very disappointing.",4,FALSE,Not that much cool,sach 420,
04-02-2020 07:18,"Goggle pay is not working in i phone 6 and 6s and the reason which google pay is saying that its for security concern. Please resolve this issue ASAP
because people buy iphone for security only.",5,FALSE,Its not working in iphone 6s,carol michonne,
04-02-2020 13:54,"Hey team,

I’m writing this to you because from past couple of weeks google pay app is not working in cell phone (iPhone 6s) could you please resolve the issue at the earliest?",4,FALSE,Google pay not working in iPhone 6s,Prabhu from bangalore,
31-01-2020 09:08,I am using a google pay but now unable to use google pay the I’m using I phone 6s error message is - Activating UPI is not supported I phone 6 & 6s anymore bank security reasons.,5,FALSE,Unable to use google pay,ap.vinay7,
28-01-2020 12:21,"My account got disabled and when i try to restore it, it shows up UPI couldnot be activated on iphone 6 and 6s.
What is this????
Do i need to buy another phone to use your app now??
Please follow up and make the issue resolve ASAP.",5,FALSE,Error in activating UPI,saiteja. chakravarthy,
25-01-2020 08:58,Activating upi is not supported  on iPhone 6&6s anymore for bank security reason...this message will shown after adding the account information try to resolve as soon as possible.,5,FALSE,G-pay not working in iPhone 6@6s,svino1990,
03-01-2020 07:20,"It’s really help full in many cases , when we don have cash in hand. 
And even easy to share with friends , I really love using this app . 
I strongly recommend to my friends to use this ❤️❤️❤️❤️❤️❤️",5,FALSE,Worth the download,karthick 💥,
21-08-2020 10:11,Not able to check account balance for last few days,5,FALSE,Great app,ghncerg,
10-11-2020 03:50,"I was using Google Pay since 2018, but recently in November 2020 the app got reset....
I had to re add my bank account , but while verifying I couldn’t activate my Sbi account till today ( nov 10) 
I don’t know why, after sending sms verification it said error, then I installed phonepe and successfully added my bank account and able to transact to anyone.....",1,FALSE,Unable to activate my sbi bank account,Voyager1.0,
21-10-2020 07:59,"Stop giving scratch cards if you are not willing to give cashbacks. For the last 30-35 scratch cards that I have got every card said inly one thing “Better luck next time”, I almost felt as if I am the bad luck because of which there is nothing. So stop giving scratch cards if you don’t want to give cashbacks.",2,FALSE,Stop making the user feel bad,luckyshahji,
21-09-2020 12:44,"Why someone has to turn on location. It’s a matter of privacy, if the app is tracking my location during payment. Why not other UPI apps are not using tracking. I prefer PhonePe which is user friendly and must secured than GPay. Worst app in tracking all the user base

Google you can’t control my payment and track my location

Never introduce this app to anyone in my locality",1,FALSE,Location Needs to Disabled,Rockregs,
29-05-2020 12:45,"Dear G Pay very very disappointing on your service yesterday i have try ₹6000 pay but its not success now today morning i am try my airtel mobile to recharge with ₹ 698 and money already debited from account but recharge not success till now 
Now tell me what to do 
Soon i will be delete G pay for sure and back to phone pay as its much better for me till now 

Thanks
Bhavesh",5,FALSE,Airtel top up not success since 8 hours now,chef bhavesh,
01-06-2020 02:24,I have two bank accounts. One is linked perfectly and other one is not linked to google pay. Always getting error at final linking page. I checked with other upi linked apps there is no problem. Only problem is with google pay is not allowing more than one account.,2,FALSE,Not working app to link two UPI WAS accounts,msg@19,
15-05-2020 13:35,i gotten bank account adding error “You have used more one number in same account but i have not used more than one mobile number. please help me.,4,FALSE,I got issues when adding bank account,777aer,
18-04-2020 07:56,I am trying to open the Rewards page but when I click on it the app crashes and shuts down automatically. Could you please fix it?,4,FALSE,Rewards page causing app crash,sammysaw31,
18-04-2020 07:27,App is crashing and not allowing me to go to my rewards. Tried restarting my phone as well,5,FALSE,App crashes as I open rewards,sachin0922,
03-04-2020 07:50,"I’m not able to transfer money, always says payment failed",5,FALSE,Always payment failed for last on week,gsaandy,
03-04-2020 07:23,"Google pay is the best app.
Fastest service and trustable app.
I'm using this since 4 years. I never disappointed with this application.
Providing good service in fund transactions, Electricity bills, bill payments. Almost ultimate.",5,FALSE,Xlent service,Hanuma Kumar Merajothu,
24-02-2020 10:01,Please note my issue I started using this app today while I was open this app I can’t add federal bank account why?? I tried morethan 20 times please solve this problem,5,FALSE,Add bank issue,ahmad sajad,
31-03-2020 07:33,"I have paid some amount by using gpay but my friend didn’t received money, as per the gpay rules need to wait for 3 to 7 working days to get back deducted money to your account. After waiting for these many days i have raised dispute in gpay app. Had a call with customer care, shared necessary documents wasted my time explaining my issue repeatedly but still my problem not resolved",1,FALSE,Poor service and worst support staff,reddisudhakar,
14-02-2020 06:31,But the problem is I’m not getting scratch cards even if I get it is showing better luck next time why so ?! And also my amount is not returning till 1 week,5,FALSE,Nice,Priya Amilineni,
01-02-2020 09:29,"Hi team,
Kindly look into this matter as soon as possible. Whenever I am trying to restore the bank account, a message  pops up saying activating UPI is not supported on iPhone 6 and 6S anymore. Please resolve this thing. 
Thank you.",5,FALSE,Not Supporting,Suneela Sukka,
05-02-2020 16:48,"When the payment stuck in processing app says it will take 5working days to send payment. Don’t know who will wait for 5days for the payment.. they will forces us to pay by cash. This is worst. 
Also don’t give any scratch card, we don’t have any time to scratch and see the better luck next time😜 not 90-95%, it is almost 100% better luck next time only😡",1,FALSE,When the payment stuck in processing,Vijayakumars,
25-01-2020 12:54,"Hi, I am not able to restore my bank accounts  and it is giving me an error saying cannot restore using iPhone 6s.. please look into it.",5,FALSE,Not able to restore bank accounts,AktarS,
12-01-2020 17:40,The app keeps logging itself out and ask me to login and verify the account again and again. Please fox this problem,5,FALSE,Great App but laggy after the recent update,#1. Vicky99,
26-07-2020 03:15,"If you want fresh seafood to buy for weekend. This is the place. Brings small quantity every day and finish early. Opens at 7:30, good place to buy fish.",5,FALSE,Fresh mangalore see food in Jakkur,Jay Kalmadi,
28-11-2020 02:10,As the new version you launches whether the UI looks good but as I update it to new version the app takes too much time to launch hangs again and again takes too much time. The older version was much better smooth operation and done payments in seconds while in this version it takes minutes jst to reach on the scan QR process.,1,FALSE,Older version was Much better,The Bharat,
17-11-2020 06:24,"We are using google pay almost 5 years nd now after update this latest version. I am not able to do any transactions bcoz its showing error to add bank account which is already used by me.

Very disappointed for this updated version from last 2 dats i am try to support also but not success.",1,FALSE,Not able to add bank account,skb005,
16-11-2020 07:54,"I’m dying to link my hsbc AC to the gpay app, and getting an error of u76. I tried all contacting the call centre which says this can’t be support right now on ur device.. I wonder why have a call centre if u can’t respond or help... I have been trying to add my Ac since one week.. but in vain hopefully u can resolve This issue or else will be forced to switch to any other repayments app.",2,FALSE,No response,Shraddha83,
09-11-2020 07:07,Guys dont use google pay for customers or some other to unknown person bcz if it will not send money was processing means dont give money in hand let be wait for days bcz i used to give cash in hand and 2days after processing was success then i loss 3k another i gave 3k in hand  worst google pay dont use this kind of transaction totally disappointment 💔,1,FALSE,Worst google pay reward,popeinzzs,
07-11-2020 06:24,I was using GP for almost a year and it was working fine till this new update. After this new update I’m not able to activate my bank account  and I’ve sent 10-12 messages to verify number and it fails everytime and at last they said it requires Ios 13.4 or above. If that was the problem then why i wasted 10-12 msgs on verifying my number.,1,FALSE,Not able to activate my bank account,Himani143rajput,
01-11-2020 09:16,Sir I am unable to upload credit card  no such option is showing only Bank account can be added pl check,4,FALSE,Payment through credit card,smd1974,
26-09-2020 04:07,I lost my money in this google pay app....In the starting I took it lite hoping that the money will be reflected to my account or the sender’s account.....Its been 3 weeks there is no detailed confirmation about the money that displayed transaction processing..... else I will move further in another ways to get back my money filing a case against you with all the receipts I have in the app.,1,FALSE,Best of worst app in play store for money transactions.,Gnani 💙,
23-09-2020 08:13,It would be nicer if you show only few recent contacts instead of showing all. It’s terrible to scroll go down to check business contacts.,4,FALSE,Need iOS app UI improvement.,KoMaDee,
15-09-2020 23:22,"I have a pending  transaction of 1000₹ on 2nd of November, the money has been deducted from my bank 18days before,it is neither reflecting in my bank account nor the other person’s bank. Multiple time I have been given you the feedback but your customer service is not even responding. It is very disappointing please revert me back my money and I am not gonna use this app anymore.",1,FALSE,Transactions problem,solo soulmate,
25-08-2020 18:58,I would had rated 5star but for that you you need to add a feature of payment through Credit card also.,4,FALSE,Credit cards payment option not there,nikhil bhojak,
02-06-2020 02:40,"I have done dth recharge through g pay. It’s very fast and reliable service. Thanks for your kind service.

Mobile recharge is so fast. Best application. Thank you google pay.",5,FALSE,DTH recharge is so fast . Thanks for the service,Sudhi digital seva,
06-07-2020 08:03,"Each time I click on check balance, it says there’s some error in gathering information from your bank. 
It’s been the same for past one week. 
Kindly resolve this as soon as possible. 
Thanks!",3,FALSE,Can’t check balance,_Vds_,
01-05-2020 12:58,I have never seen such a wonderful app. Just link your bank account and you can easily transfer money. The best feature Tez mode. Thank you google.,5,FALSE,Google pay,SandipatPar,
13-05-2020 12:25,"If you want to use This app. Be aware. 
Your money can get stuck. 

I don’t know from where to start. Because transactions failed many times. I don’t even remember.  
It says money gets reflected in 3 days. But it doesn’t. I waited for 7-8 days. But meanwhile if the transaction is urgent. You have to again spend money. Imagine the loss.

Also, I had tried mobile recharge. Transaction failed and money got deducted as usual but mobile network operator said at their side money is not reflected. Hence the outgoing services were inactive in spite of paying bill.",1,FALSE,Transaction failed many times. Money gets deducted and does not even reflect back.,kam@123,
20-04-2020 10:42,Whenever I try to click on rewards option it crashes the app again and again. Please fix it ASAP.,5,FALSE,Bug,Manzi-46,
01-02-2020 17:19,"I am unable to activate the bank account on google pay,
Getting the message that activation is not working due to bank security on iphone 6 and 6s",5,FALSE,Unable to activate the bank account,shaikhsakib74,
13-02-2020 09:39,"But as compared to google pay paytm google pay not gives much cash back .on the transfer of 7000,5000or500₹ then also maximum I get is ₹15 otherwise it shows better luck next time this disappoints me alot. So paytm is better in this case . Otherwise everything is fine",3,FALSE,App is good,sakshi@12,
08-01-2020 06:04,I'm calling since 3 days back to support number of google pay but no one is responding even once. Is this a service you guys are providing. This is really a worst experience of mine.,5,FALSE,Support,Amatoya,
11-12-2020 09:18,"Great app 
But need 1 update I don’t use mobile screen lock but to use gpay every time I have active screen that not good please add pin lock only for gpay app
Thank you for great service",5,FALSE,Need improvements,Tushar_S_S,
01-12-2020 10:19,"Unable to login app from today only. Using iPhone 6. Yesterday, it was working fine. After thumb impression black screen get appeared and app get automatically minimised.",5,FALSE,App is not working,ss111989,
10-12-2020 13:25,"Hello Google, I really don’t understand why you have given a option for Apple iPhone’s to enter Passcode. I don’t (want to) keep passcode for my phone. Frequently i use phone for my other office apps. I request you to remove this feature from Gpay.",3,FALSE,About Passcode,11 Million,
06-12-2020 23:25,"G pay is not working in my i phone 6 every time i try to link my gpay with my bank account the app will always showed me the same reason don’t switch the app while verifying after that g pay giving one more error this software is not trusted by act of (NPCI) national payment corporation of india
Why only this both device 6 and 6s is not trusted by NPCI guideline please solve this issue as soon as possible",1,FALSE,Error by (NPCI) in i phone 6 and 6s,azim_khn,
29-10-2020 10:50,Guys get your act together. We bank on google pay to make quick payments. Have been facing issues from last couple of weeks where I had to add bank accounts everytime I make a payment and had the payments fail eventually.,3,FALSE,Repeated failures,WormHoleWobbler,
28-10-2020 10:05,"Not sure why this happens ,when ever this is ux updated then it’s asking for re authentication of upi accounts ,BHIM phone pay works fine and sim didn’t changed ,no idea why do we have re authenticated each and every bank account after updated to app.",3,FALSE,Re Authentication on app update,Bharath_V,
13-03-2021 06:01,"So my story short, i believed google, started investments via gpay, groww app, all payments via gpay etc all we good. One fine day my gpay opened and it was shown the account is temporarily suspended, please fill the form. I did the same, my debit card pic was asked, gave it, bank statement, all whatever required was given. Despite that there was no ray of hope from google. Finally i tried reaching the google support center which is actually not even there i feel, coz there is no customer support even properly. Finally after a long queue i made it to the customer support executive, now from there the same thing is happening for last few months. First they ask what the problem is, i tell what happened, they say they need to check on it, i tell its already done many times and dont you guys have any records of this, they say no, we need to check again. At last a mail comes saying, we are sorry, we cant discuss whats the issue but we are sorry for the inconvenience. I mean if you dont know the issue then how could you rectify it? I had a word with a senior authority from google and checked and verified my account saying no issues at all...!!

This is a classic example of how a huge company treats the small finances of a common man. I will be taking this legal and will go to wherever it has to be...!!! I am not able to manage my finances and investments just coz i trusted this...!!! Please dont be in trap...!!!",1,FALSE,Ravishankar1991,Worst service ever,
20-12-2021 18:50,"Until recently, I never bothered with the Google Pay transactions that get stuck in “Processing” assuming that they would fail eventually. Apparently, these transactions can be successful after a few days (Poker Face) and the Google Pay customer service team proudly claims this to be true but “unfortunately” cannot do anything about it.

So imagine if your transaction gets stuck in processing when you are paying a shopkeeper, you will have to pay him again if the transaction does not clear in the next few minutes because he needs to be paid and cannot rely on Google Pay’s “processing” time. Now if the transaction becomes successful after 2 days, you would need to go back to the shop again for a refund and explain the “processing” time Google pay takes. Imagine paying on the way while travelling long distances, you do not even have the contact numbers to reach out as they are masked on the Google Pay app.

I am guessing this would be an issue with other payment apps as well, though Paytm upi has let me down less number of times. I would rather play safe and use Wallets (Paytm or other) rather than UPI for random payments.",1,FALSE,Just.Another.Brick.In.The.Wall,Flaw with Transactions,
