date,review,rating,isEdited,title,userName,developerResponse
02-01-2019 05:25,today’s payment of 250. I cannot see scratch card that I earned today.. however in inbox it shows that i did earn,5,FALSE,Can’t see my scratch card under reward for,diksha srivas,
01-01-2019 13:49,Very easy and convenient to pay and receive..liked it very much and would highly recommend to use this app for an easy way to get your money👍👏,5,FALSE,Fantabulous 😘,Pehei,
05-12-2019 05:06,I only use google pay because I have my trust on Google pay its the best app and very easy to use also when I get cash back I get happier thank you Gpay for making such a great app,5,FALSE,Google pay is the best,Devil2105,
11-12-2019 19:18,What is the problem with app why it’s asking to reactivate the bank account every 10-15 days. Why the app is getting restarted automatically for every 10-15 days if this goes continuously you will loose the users. Instead of giving better luck next time regularly in rewards please stop giving rewards or else users may change your app name to better luck next time app.,1,FALSE,Worst app,ajay vemisetti,
18-11-2019 05:35,"On of the best app. However, on a lighter note, the number of times I have been told ‘Better Luck Next Time’ by Google Pay is more than anyone in my entire life. I don’t win anymore.",5,FALSE,Service,Abhishek Ojha,
01-11-2019 04:41,"Money transfer between my own accounts should be facilitated.
And i don’t understand the necessity of turning on location services.
And reward in my case are only day-dreaming..",5,FALSE,A few drawbacks,Chandra Sekhar Mondal,
13-08-2019 14:39,"It is very good and convenient app to use for transactions. I use it for most of the transactions. Scratch card doesn’t give cashback though. 😛
But it is not working after the recent update.",5,FALSE,Amazing app,shiksha_18,
23-07-2019 18:20,This app wants your location/microphone access for every payment or it doesn’t work at all. Apple is all about users privacy and this app is not anything like apple. It’s a shame that google has done this. It should be optional if the user wants to share location or not.,3,FALSE,Privacy Concerns,indUser,
16-06-2019 06:58,"Transaction success rate has to be 100%, unless there is valid reasons. It cannot fail without knowing reasons. Also, incase of failure, money refund has to be immediate (can’t imagine whay can this happen immediately).",4,FALSE,Sometimes it simply fails to carry the transaction.,TNMANJU,
25-02-2019 07:55,"Every time i try to restore my account, message sending fails. Don’t know why, i have balance in my Sim also unlimited pack enabled still msg sending fails. When i send a msg to other ppl it goes without any error. Plz fix this. Or else add another method to restore account.",3,FALSE,Bank account restoring error,:)Yogesh,
15-12-2019 09:21,Im not getting any notification sound or banner or badge in google pay regarding any request of payment...  there is no Googlepay app inside settings>General>notification,5,FALSE,No Notifications at all,Mari Marine,
17-10-2019 18:12,Add a search option that we could probably search instantly by typing the beneficiary name which was done a transaction earlier,5,FALSE,Add one important feature,Korou Ashem,
27-10-2019 10:10,Google Pay is very good app but there is no any way to delete the transaction... some time we want the transaction but not any options there requesting to team give one option to delete the transaction after it’s done.,3,FALSE,There is no any option to delete the transaction,Parag Mankar,
10-08-2019 08:12,"I am having a problem with google pay its not opening in my mobile from last 3 days,currently iam using Iphone 6",5,FALSE,Issue with google pay,Upasi Kiran,
10-08-2019 04:29,"Every time I try and need this app, it does not function and says poor net connectivity. I could only use it by the internet connection of wifi",5,FALSE,Not made for iPhone I suppose,hrihana,
23-07-2019 05:53,"It should not be that way, we pay via google pay so that our works are done on prompt basis",5,FALSE,Time taken for the payments to be reflected in account,sheetalallwyn,
10-04-2019 07:25,Before few months scratch cards only showing “Better luck next time”. Also in the case of monthly bill paying. So i lost my all interest on this app. Next time i will use other payment apps.,4,FALSE,Scrach cards are fraud,shahas k,
04-04-2019 06:27,In my family four of us use google pay After trying 10 times also we are not able to check our account balance everyone has different bank and network.,3,FALSE,Can’t check account balance,P Rohan,
09-04-2019 18:16,"Works completely fine for the first few months with a good influx of rewards. This influx of rewards stops after a while, but hey, that’s fine, atleast the app works quite good, it’s pretty and simple to look at. 
But no, eventually bank servers will never be available. So now, you have a useless app on your phone, which you might keep thinking it might reward you someday. 
Switch to BHIM, it’s reliable and works.
SC",1,FALSE,Stops working.,Halbrüdder,
20-03-2019 15:56,"After upgrading to 30.0, app did not open at all. I restarted the device, but no luck. I deleted and downloaded it again, then it opened but got stuck on payment page as it keeps on asking to turn the location on even when the location services are enabled. Please fix this asap",2,FALSE,App v30.0 not working on 12.1.4,Danny2386,
22-01-2019 09:07,It is displaying unable to add account as cellular network is available even though my network is fine..Kindly help me,5,FALSE,Issue with adding bank account,saileshCR7,
04-01-2019 21:56,"Hi all

I was supposed to receive money in jan 1 where the status showing as devi Ed but not yet credited to bank account when I call customer care they say different stories each time when I connect to them and behaves like they are transferring their own money I suggested not to use this fraud app where you cannot ask bank if something goes wrong and you don’t have proper customer care",1,FALSE,Fraud app and customer care,swathi kunar ravi,
30-10-2019 14:20,Gpay is most wonderful app which has trumped payment and transactions very smart and easy by making banks at your real finger tips,5,FALSE,The One App for all your payment requirement and bank transfer,Anjali Kattumoochikkal,
10-12-2019 09:27,"From last 1 month my google pay is not working properly .....every time open google pay app ,the app automatically shutdown and error shows that there is no internet connectivity... I have to choose different app for payment ...",3,FALSE,Poor service,parth..,
17-11-2019 13:39,Many a times it’s difficult to find the other uses like mobile recharge bill payment that option must be on the first page ...,4,FALSE,Easy user interface,khanchi19,
08-11-2019 10:26,Useless app. 10 failed attempts since morning to pay water bill. Took forever yesterday to approve bill for swiggy! And finally got a message that payment couldn’t be done. Shame on you for being such a reputed brand but providing such low level services. And don’t say it must be my banks fault etc because it works fine on all other apps.,1,FALSE,10 failed attempts to pay water bill,anu9193,
03-09-2019 04:56,"Transactions are hung and exits abruptly. Then when retrying a new transaction , Observe money gets debited for the failed transaction as well.
Very unreliable application. Your are playing roulette with other people’s money .",5,FALSE,Most transactions hang,medeapalli,
29-10-2019 10:24,"If you are giving prize for collecting stamp . Then it should scan all the things which are there in stamps . We have scanned rangoli so many times but not able to get that. I have done transactions through gpay as well. 
Moreover it’s not a scanning rangoli as well when we scan rangoli it’s coming diya or jhumka . That’s not fair at all. Then how should we get rangoli",2,FALSE,About the diwali celebrations,Rahul_nanda0786,
20-08-2019 09:52,"Dear sir
Am sending amount to my friend he have need money in emergency but she not receiving my money and still it’s processing. so am given amount to her directly.
So please cancel this transaction and refund my amount please sir
Thanking you sir",5,FALSE,Help me sir,mani1089,
14-07-2019 17:57,"Though the payment fails once or twice and the amount is debited from the account, it works like a charm for most of the part and the UI is neat, clean and less cluttery than their counterparts",5,FALSE,Best payment app ever 😍,Normangard,
07-08-2019 12:56,"Payments fail and then we have to keep the transaction on hold for the next 3 days till we get a clear confirmation from Google Pay that transaction has failed. 

Both the sender and recipient are aggrieved and can’t do business till then.",3,FALSE,Payments fail lot many times,The Extropian,
03-05-2019 07:05,Easy way to use and make transactions. Also get rewards by scratch cards to check your luck on the prize money,5,FALSE,"Fast, quick and easy",poorna bhaskar,
08-03-2019 11:16,"Every time new update comes up , bank accounts get blocked need to restore every time 
Pls fix this issue, down from last 4days",5,FALSE,Unable to activate account,Gowri.shan,
03-04-2019 16:00,"Sounds funny right ?? 
Actually I did a transaction of rs 2500 to my friend but the status shows failed at the end .. and my money has been deducted from my account ..my friend didn’t receive any amount nor I got my money back to my account .. I don’t know what’s the reason please help !!",3,FALSE,I hate this app like I love ..!!,shubhamcnnnews18,
18-02-2019 19:34,"Please provide an option to delete the chat/transaction history in Google pay.

Thanks in advance",5,FALSE,Delete transaction history,sPradeepKumAR,
11-02-2019 03:24,I am a NRI. I stay almost 355days outside India but I need to use google pay for my indian accounts. And I need to use other country App Store also for other subscriptions. So you all want me to change to indian App Store every time to download and update this app???? Google pay should be in global App Store like paytm and other which we can use in other countries also.,1,FALSE,Why google pay this version only available in Indian store,C⃞h⃞i⃞r⃞a⃞g⃞,
04-12-2020 04:39,"From last 7 days the transaction is not done due to technical errors most of the time.. it says your bank server is not responding, technical issue etc. So I went to my bank to tell that this error is appearing but they say Our bank’s server is good; problem is with your GPay.. in 24 hours schedule only few minutes or may be an hour I can Transfer Money but the whole day it’s showing error.. I also try to check My internet connection whether it’s properly working or not but I found my Internet connection is Good.. my GPay app is also updated and I believe I check marked every possibilities for a customer to use GPay.. I am so frustrated that my GPay is not working properly when I needed the most.. In business Hours If it’s not working then it’s useless to me for continuing use of GPay..  
I can understand If it would be for 2 days but it’s already crossed limit now.. So Developers please Look into this matter As soon as Possible and resolve this problem.. I hope I’ll reuse GPay soon...",5,FALSE,Drawbacks of GP nowadays,Paul Kolewad,
15-10-2020 16:15,"I did a high value transaction and after entering pin, got an error message which said ""Payment failed - Oops, something went wrong. Try again."" I retried and got the same error again after entering pin. I checked transaction history in Google Pay and there were no entries. A few minutes later I got SMS from bank for two deductions. I looked in the Google Pay transaction history, and now it was showing two successful transactions. I contacted Google Pay support and they said since the final status is success they cannot do anything. When I pointed out that their app had given me a wrong status and actually encouraged me to retry, they brushed away their responsibility saying we are only an intermediary, and you should contact your bank or the recipient. So be aware that Google Pay is just an intermediary and won't take any liability even for their own mistakes. Be really careful when transacting, especially for high value transactions. You are better off using your bank's app, even if it is unfriendly, since they take far more precautions to ensure transaction security and if something goes wrong, they are liable.",1,FALSE,You can lose money even if status says failed,nmohideen,
20-11-2020 16:42,"I had to reset my phone due to some issues and I reinstalled google pay. Then I tried to add my account but it needs to be activated. To do it I need to verify my phone number with my bank. I have been trying to do it for 2 days. I’m struggling as it says ‘server cannot be connected’ and sometimes it says- ‘Device not supported
Activating UPI is not supported as per NPCI guidelines on iPhone 6 and iOS versions below 13.4. Please upgrade to continue using UPI on google pay.’ I’m using an iPhone 5s and my software (iOS 12.4.9) is up to date. I have been trying to contact the customer care regarding my issue but there’s no one available. I prefer to use google pay. I’m writing this review so that I get a solution if not then I have no other option other than using other alternative apps like phone pay or paytm. It’s really not fair that customers using your services has to struggle this way. I request you please have a proper customer care customers shouldn’t have to struggle this way. Kindly do the needful. 

Thank you",2,FALSE,Unable to Activate account & verify mob no.,WAR DADDY 1997,
04-06-2020 05:11,"I made a payment of Rs 3750 to an agent through google pay....the money got debited from my account...it has been a couple of days and still the transaction is in processing status which denotes that the money can either go into his account or even come back into my account but i need to wait for the result for a couple of days. In the meantime, since i had to get my work done at that very moment i had to pay to the agent Rs 3750 in cash. It was unavoidable because the agent was not willing to do the job until he gets the full money...so now the problem is i want to cancel the transaction but it is not possible...now if the money goes into his account i dont know if he will return it...so i guess  i have lost my Rs 3750...Thanks to google pay.

One more thing i tried calling their customer care number but it says due to COVID 19 their customer care executives are not available,not even a single one...it is closed.
So I would suggest close any transactions from your app if you cannot cater to your customers.
In short the worst payment app ever!!!",1,FALSE,Worst app,Cosmin donose,
09-10-2020 07:52,"I love this app and it is really useful but there are some bugs and issues as automatically my upi id is changed, transaction amount changed no history shown. I think it need to be fixed on immediate basis. I dont know if I am using Iphone or it has been installed here thats the reason this is the issue or might be system fault. I am using phonepe, paytm, and others which usually takes times for loading but it is useful and no complain yet. But this is the first time I am doing comain about this app. Kindly check this issues or else payment will be released from third party but cannot received in this account. UPI id is main thing for google pay. Kindly resolve the issue. I have not received any money yet since I am fighting but later I found my UPI is changed suddenly within a month. I dont know what's the issue but resolve it as soon as possible for a better use.",3,FALSE,Not happy,8258995751,
18-01-2020 18:47,"As it has been a long time that i am using google pay for my all transactions,  i want to discuss some issues
1) sometimes i faced issues when transactions were done and account was deducted with amount paid but beneficiary has not received the amount and it shows amount to be reflected within 3 days. But even after completing 3 days amount is not paid in the account of beneficiary. There should be message alert from google pay if refunding of amount is done.
2) it takes a long time of upto 3-4 days for confirmation of bill paid for electricity. It would be better if time taken will be less.
3) in scratch cards you get for transactions, what is benefit of giving coupons on jan 2020 if the offer was valid for redeeming coupon in November 2019. Its just like fooling the users. Kindly look into the matter and do the genuine offer schemes.",3,FALSE,Issues,the_akash_thakur,
19-03-2020 13:52,"It’s not able to do the one thing it has be created to to do, i.e. Payments ! You guys should focus more on providing the basic services like payments and other transactions instead of giving stupid scratch cards of 10, 15 rupees ! It gets on my nerves when I really want to make an important payment and the app goes oops !! Why ? Yes I agree it works but only for 10% of the time rest of the 90% just goes oops ! Oops oops ! It never really works !!!?  Tired of this dumb app ! I thought this issue would be fixed, google is such a giant, can’t you guys figure out this much !!!? Always have to keep other wallet apps  and bank owned apps! Google pay is utterly unreliable.",5,FALSE,Disastrous app of all upi apps.,samsrail,
04-08-2020 04:12,"My transaction was done in 20th February 2020 for the amount of 1750 to a restaurant and the transaction was showing failed but money way deducted from my account. So I contact google pay customer care and I was asked to fill dispute and send my bank statement for a proof and I was told to wait . After a week again I was told that the document is incomplete and was ask for recipients bank statement . How can you expect me to give recipients bank statement when I just visited the restaurant just  for dinner that day . After that I again kept on asking for help every time the reply is same they are not getting my problem. As it was too much for me I told to escalate call to the manager I was given a fraud number. The person tried to fool me and when he was caught he started abusing .
So my question is will my problem really get solved or is google pay service playing tricks to avoid my problem ? 🧐",1,FALSE,My old transaction,shrena shrestha,
08-12-2020 13:20,"Hello, I will write a review on the G-pay app. G-pay is probably one of the best e-wallet currently in India. I have been using the G-pay mobile app for more than 3 years and I have no complaints regarding it till yet. It links the debit or credit card and the addition of money to the wallet is quite easy. It can perform tasks such as Mobile and DTH recharge, bill payments such as electricity and water bills. The most important point is it’s safe and secure. I made a recharge, paid a bill for electricity, sent money to my friends and so on. It’s really quick in service and secured too. Customer support is very good as if some problem noted, they call back and help you solve your problem. A very dependable app with which to work.",5,FALSE,Bazingaa,Dr Taenia,
11-07-2020 12:46,I have been using Gpay quite a long time.. in recent days.. most of the time transactions getting failed and status says in processing.. a day back I have made a online purchase payment via UPI using Gpay.. payment failed and advised if merchant didn’t receive the payment you can try later.. then I made a payment via credit card and then order got completed.. when I checked the Gpay transactions status on the next day.. it is showing payment processed to merchant.. now it is a double payment for a single order.. merchant saying that they have received money from credit card payment for that order.. Gpay suppose to be responsible to get the money revert back to account when payment failed during the transaction.. payment system should be more efficient and effective however didn’t expect this worst product from such a giant company google..,1,FALSE,It has become worst app now a days...,Baluma007,
14-08-2020 04:04,"While all is well, there is one usecase which needs to be looked at. At times there is a delay in processing and when that happens the amount is debited from the account but is not credited into the other person’s account (merchant mostly). In this case obviously the merchant would not be sure and hence wants you to pay using an alternate mode.
Later on the amount is credited into the merchants account and thus he has now the same amount twice. 
I believe the time out should be limited to couple of minutes so that if not credited is refunded back and saves the hassles.
Thank you",5,FALSE,Delayed processing,anantk80,
26-01-2020 18:29,"I’m using iPhone 6s from today my google pay is working in my mobile ... it’s telling in 6&6s the google pay won’t support. Can you please tell the reason why??? And I’m asking you people , what are you thinking that the people who are using 6 & 6s are fraud or cheater or scam people??? Why the hell you people have blocked only certain iPhone model ??? Or you people are getting any commission from Apple owners so that we people will be upgraded to buy next version iPhone ??? The google pay association playing a very dam cheap if you people are not going to change your module of business please count your days soon google itself is going to be vanished soon and I can see ... I don’t need any kind of useless answer from you people... I need a perfect and clear answer from the developer and from the customer support and even the technical support....",1,FALSE,Google pay is not supporting in 6s reason ???,chennai anger iphone,
04-12-2020 00:02,"I was trusting blindly on google pay but I feel it’s a faltu and a worst app my frnd was transferring m the amount of rs3000/- and the netwrk was bit slow that time and the amount didn’t credit to my account it was showing processing. And after someday I got a update from google pay sayin amount is been credited but when I go to see in my account no money was credited 😡and i didn’t Evn receive msg frm bank dat the money is been credited it just showed the transaction in my account when I contacted google pay they said contact bank and when I contacted bank they said to check with google pay I feel it’s a big fraud and google pay is making fool out of us by taking our harden money like this I would suggest not to download this app 
Zero ratings for this app cause when we don’t receive the amount only blame game is done no one takes the responsibility of returning our money",1,FALSE,Worst app,angelsne,
03-07-2020 15:06,"I am using 3 UPI apps that work pretty fine but there is always an issue on Google Pay. Either the bank server is down or the transaction is rejected and even though you show the error saying ‘Payment failed’ the amount gets debited and we have to wait for 3 days to know the status and eventually you credit the amount to the party, which is a loss for us because the payment was made already by using some other UPI app or by cash. And moreover dont even put the rewards option because it is USELESS. I have done soo many transactions and i win a reward that says Better Luck Next Time. What is the use of such rewards. And this happens always. I guess i’d prefer other UPI apps instead of Google Pay.",3,FALSE,Inconvenient,iamncs,
12-05-2020 06:10,"I have recharged my phone for 700rs , the transaction was successful but the recharge didn’t happen, I waited for almost a day and contacted the support and they do not know what’s gonna happen , after waiting for like half and hour I only got the same response saying they are sorry for the inconvenience, my recharge will only happen after 3 days they cannot do any refund, I cannot call or use my internet for 3 days as if I recharge now from any other platform my money is just going for waste and the lady also ended my chat without any proper reply I have screenshots of the chats and would like to post it here or anywhere else , how can you guys be so irresponsible, just because of your negligence I basically lost 700 rs because I need to make calls and use the internet",1,FALSE,"Recharge not successful , support ending the chat without any proper response",Abhiggmu,
01-10-2020 09:07,"If any body die the transactions gpay is holding it for two days without devoting or crediting.  Who will bear the interest for two days?? One of my friend required for hospital for which we have made payment through gpay but the amount has been deducted from account but not received at the receiver point even after 48hrs... what the hell the gpay is doing it won’t take query it won’t send back money.. I am thinking that those gpay management is holding our money for two to three days and they were transacting our amount in their company and giving back after three days.  Yes it can be happen there are lot of chances to transact our money by showing technical issues.. 
take same in phone pay they never hold any transaction for days and days.. what the bloody hell is gpay... I really failed in helping my friend... sorry to say this it’s the disgusting appa..",1,FALSE,Pending transactions,mr cool 1725,
29-07-2020 07:20,"Hi I am using ur app since u launched it and its a good app to use. I use ur app on iphone X. Now due to this pandemic and everyone wearing a mask and for that reason many people have deactivated there face id feature for time being. Even I have deactivated the face id for the same reason and ur app does not work if we dont use a lock feature. Now recently whatsapp has up with the face id lock feature in the app itself so even if my phone does not has a face id set I can use face id for individual app like in whatsapp. 
So it would be great if even u people come up with the same option.",5,FALSE,Face id,Jasmeet10000,
