date,review,rating,isEdited,userName,title
17-08-2022 08:32,"Easy to use.... No hickups....easy security....fast to use...loved it 

Gpay often blocks my account based on email id...here there is no such thing...it works on phone number...great",5,FALSE,Azzu31337,"Super fast, super friendly"
08-07-2022 18:08,Number not showing,5,FALSE,Precious0509,Number save but Contact not showing problem
06-07-2022 14:08,Credit card payment done in seconds,5,FALSE,Pramod Kore,Credit card payment
28-02-2022 11:01,Year’s 365 days updating phone pe app fix ur bugs n all at least monthly once when I’ll open a app it’s always shows update update update fed up with this updating,5,FALSE,zak99khan,Update
13-05-2022 04:10,"Logde a complain of rbi website you will get solution within a week . 

Iff you send money to anyaccount mistakely then contact your bank manager and lodge a complain on rbi website . And iff your bank denies to help you rbi will take strict action on that bank but do lodge the complain to bank and rbi website as soon as possible .",3,FALSE,from vk tastebuds,RBI baap of scammers
19-01-2022 15:02,The application hangs when a payment is done and closed and you want to make another payment after sometime in different places so you will have to close the entire application and open again,3,FALSE,flavi124,Lag issue in iphone
26-04-2022 11:44,The app gets stuck after returning from background. Non of the options are clickable.,5,FALSE,supratiksaha7,The app gets stuck after returning from background
08-12-2022 10:05,"I made a credit card bill payment using PhonePe on August 30th by adding my credit card details in PhonePe, and the same added card is selected on Nov1st and paid for Oct month bill payment. This time the amount credited to the different person’s credit card instead of my credit card and I am try to connect for the support but there is no resolution has been provided till now.
1. No customer support number,
2. No proper support
3. No proper resolution 
4. People they call us are not having access to the right information.
5. Without providing resolution the customer support persons are dropping the call in between",1,FALSE,Prabhu819787,"Fraud app, no proper response, no customer support number"
13-06-2022 10:23,It’s Been Almost 1 Month I Transferred Money To My Frnd Account But In My Account money Has been Debited  But Receiver Doesn’t Credited Money It’s Failed Payment But App Agent Saying That U Vill get Money in 3 or 5 days But It’s Been 1 Month I Didn’t Refunded My Money Worst App And Worst Response Please Don’t Trust This App Thank You,4,FALSE,Pavan kumar putturu,Fake App
04-06-2022 06:04,"Facing issues while checking bank balance 
Or transferring payment",5,FALSE,Chetz198,Not working properly from some days
20-05-2022 01:06,Need Phonepay customer officer District wise. When we called customer care they will PT anser proper even they don’t pick the call. Where is the Phonepay branches near to me to go and ask problems.,5,FALSE,kurubarapte venkatesh,Dead of customer care
16-01-2022 16:52,"hello PhonePe

I've been using this app with no regrets
Transaction Description is the cool thing you guys have integrated; i just thought of sharing something like it can be really cool if you guys add "" EXPORT "" option that can expot monthly or the filters you've implemented into the csv format or excel whatever is cool labelling 

1st colum - money spend
2nd column - Transaction description 
3rd column - Date & Time

adding this thing really boost interest in ur app also it'll be pretty easy to track transactions for all the users",4,FALSE,_MacRoBoT_,The Update That Can Be Useful
22-05-2022 01:19,"Hello team , 

I not sure either problem with Concerned bank UPI or with PhonePe side , many times I get service unavailable. 
Kindly work on specific exception handling for better understanding. Any way I love PhonePe",5,FALSE,Basu Dapalapur,Service unavailable
09-12-2022 04:36,"Requesting PhonePe to add a download statement feature for wallet transactions mutual funds etc. 
it will make the app more useful. As 41.5 crore people how are using phonepe will be able to download the transaction in any format may be in excel or pdf. 

PLEASE ADD THE FEATURE ASAP",4,FALSE,1toz,Statement download feature missing
09-02-2022 04:31,I have funds in phone pay but too it’s showing insufficient funds what the heck is going on in phone pay 🤷‍♂️😤😠,5,FALSE,zen ganing yt,Giving false information
17-04-2022 05:21,"Certainly one day showing your account blocked,I was ready to submit documents again but still they denied,this will cost in long term ,I was using app for a long time,what I can say more😔",4,FALSE,monishrai,Not value of customer
23-01-2022 18:15,I am unable to use phone pay app last 25 Days phone pay supporters saying your proble is resolve but problem not solve,5,FALSE,Riyaz khan 6086,No Response from Phone pay support
18-12-2022 08:52,Your scan and pay is not a user friendly interface,5,FALSE,koopoooop,Sinconvenient scanning profile
23-12-2022 06:32,"We are really enjoying the chat feature. Thanks to PhonePe. Please bring sticker, delete for everyone and status/story feature. Kindly remove the block option 🙏🏻.",4,FALSE,m.mohmed aslam,Chat feature
28-08-2022 00:13,I was stuck in airport while come from international bank account verification done immediately while I try many times in gpay was not possible,5,FALSE,nk jagne,Superb app fast n relabel
01-10-2022 07:02,"Started With very good number of successful transactions and cash backs, now it failing more often. Just lesser than google pay which is completely failure. UI and icon after good not easy. Started charging extra charges on fastag recharge. Mobile recharge option is completely fail. Doesn’t work at all. App is more about selling insurance and other finance products.",1,FALSE,Gamer>A,Consistently getting worst.
27-08-2022 16:56,Everytime i pay my rent through sbi credit card it declined and support another card in the same period sometime it support SBI and declined another one,5,FALSE,Phonepe slow h kya?,Rent payment Error
06-08-2022 12:35,"Transaction history shows up only 1 year records. Internet search asked me to call customer care for help but hard luck.
A fintech app which doesn’t have an easy way to view and download [all] the transactions history is a worst user experience platform.",2,FALSE,SreekyReddy,Transactions history from the time I downloaded
30-05-2022 10:27,Every time I leave it open for a while it gets stuck basically and then I have to basically clear the app again and then start the app I mean I have to restart the app,4,FALSE,hwp180696,App gets stuck
27-04-2022 08:47,sending money by QR scanning a option to writing a message notes but this message notes doesn't show when i check in history after sent money. but this bug doesn't occur on sending money by mob. numbers. plz fix it. and also person’s profile pic is not showing.,1,FALSE,#NAME?,transaction remarks not showing and person’s profile pic not showing
17-01-2022 23:05,"Why am not getting to option to remove autopay? I did not want to set it up in the first place, did not get the option to stop the app from setting up autopay and then inside the app also there is no option to remove autopay. It’s my money and guess what I don’t wan to spend even a rupee without my knowledge. If I want autopay I’ll set it up, don’t want the app to do it for me.",1,FALSE,Siddhant_bing,No option to remove autopay
13-10-2022 03:55,Service is good but recently extra fee collected for reacharges and bills is not good more over your rewards are not useful I will request you please give the money rewards only,5,FALSE,rajabbai,Yours lovingly consumer’s
19-10-2022 08:06,"Every time i paid a payment, after that for next payment if i want to scan , it doesn’t respond at all.
So then i have to forcefully close the app & reopen it then only i can pay another payment.

Kindly fix it , it has been a problem for so long",2,FALSE,himanhd,App crashes after every payment
29-07-2022 04:16,"If we have widget for scan and pay that would be great.

Also in the app the scaning is on the top. If it would be in the bottom like floating that also will be good.",5,FALSE,Ben1son,No widget
07-05-2022 04:40,Few days. Every recived and transfer amount showing always prosseing status… it’s very difficult to knowing which transfer amount is successful or not…,4,FALSE,Ch. Sameer,Confusing transfer
06-12-2022 14:30,"Using phone pay for the first time. It’s super fast and user friendly, so that someone like me who is not familiar with these apps can use it. Thanks!!",5,FALSE,cheerfulsuhas,Wow it’s user friendly
17-09-2022 08:33,Bit hard to understand,5,FALSE,Rathore Marketing,Phone pay
04-09-2022 04:41,Stop taking extra charges on recharge and all. Other app not taking any extra charges. Why do you charge ? Poor company policy. India should banned you,5,FALSE,tajiri123,Charges
23-01-2022 11:07,You can’t send money to any person without linking ur bank account….even by adding money to ur wallet u can’t send unless u link ur ac…Paytm has that option so I believe Paytm is better,5,FALSE,sameershrivastava,Bad
09-03-2022 09:03,Now a days im facing lot of errors in PhonePe. Today (9-3-22) my payment was debited from my account but not credited to beneficiary account. This is not first time. In last two months I’m facing this issue more then two times. After two days only amount credited back my account. Phonepe will go on Very worst in last few months,2,FALSE,Sowndhar MG,Debited but not credited
10-10-2022 02:55,"I lost my 400 rupees and but not sure when they credited my account 
My money debited from account but not credited in another account 

Please improve the process by developing",5,FALSE,warrrriorrrrrr,Lost money
15-11-2022 08:20,"Phonepe making fools by giving useless coupons. And there is no proper information how to use.. they gave behrouz Biryani 50% off coupon, for that I have installed Behrouz Biryani app and I tried almost on all biryanis but it is showing this coupon is not applicable for this flatform. And not only this almost for same only.. really making fools🤭🤭🤭🤭",1,FALSE,DevS11,Making fools by giving useless coupons
15-03-2022 16:19,Hi I no need to explain anything about phone pay it’s really helpful using phone pay for immediate transfer of money in emergency situations,5,FALSE,mehar indi,Good experience with phone pay
22-02-2022 05:11,Why my iPhone 5s version higher 12.5 but not compatible devices show up notifications please reason tell how to use my iPhone support,5,FALSE,Maarisg,Maarisg
19-07-2022 10:13,We want to delete our chat transactions so please give delete option!!,5,FALSE,mpavan07,Request
10-07-2022 08:08,"Hi team
I am not able to download latest as it am using I phone . Please do needful as I am not able to verify due to this.

Regards 
Naresh",5,FALSE,naresh shetty,Not able to download latest version
09-06-2022 09:59,There should be more and smart filters in history section. The current filters are barely of any use.,4,FALSE,nAp$t3r,Need more filters in history section
22-09-2022 10:50,I found this app very convenient and user friendly. I do most of my day to day payment through this app,5,FALSE,mukmit,My experience
20-08-2022 12:43,"The App does a good work for the entire world to the work from home and trasfer the money to one another good job keep it up for future and best of for serving the people 
Thank you",5,FALSE,Fardeen28,Excellent PhonePe
20-08-2022 08:06,"Almost a decade back received a cash back reward and till date no other one ,feeling like deleting the aap",5,FALSE,iphone hyd,No cash back rewards
09-06-2022 04:34,As a banker myself reviewing different upi apps PhonePe has one the most user friendly interface.,5,FALSE,Ashutosh Vk,Most user friendly interface
26-02-2022 15:00,"Sir problem still as same as earlier, still showing the Same ,I am unable to login to phone pay . I do not get otp when ever I tried it’s show unable to proceed something went wrong",3,TRUE,saumya 22,Unable to proceed. Something went wrong
25-02-2022 14:20,Why don’t i select a contact from my list of contacts while sending money. Always i should select from transaction history or enter mobile number manually (only for the phone contacts),3,FALSE,Bharath vankireddy,Moderate
23-11-2022 17:09,Can you guys please add a scanner widget for the next. It would be great to access the scanner without opening the app every time through shortcuts,5,FALSE,Mo powh,Scanner Widget
15-11-2022 16:52,Best platform for credit card payments,5,FALSE,Amanandzoom,Credit card payment
10-10-2022 05:42,Please provide a option for unknown history delete,5,FALSE,rajveer suryavanshi,Regarding history delete
19-10-2022 03:08,It does a lot of things well. I wish phone pe had a widget option like what paytm has where you can scan directly without opening the application.,4,FALSE,vijayth,Great payment application
07-09-2022 13:00,"Hi Team 

I could see currently app is allowing to add the same bank account multiple time and even we can activate it. 
Could you please check on this whether it is an expected behaviour or it’s a bug to be rectified 

Since as a user I don’t want to add the same bank account multiple times as a payment mode 

Thank you",5,FALSE,Siva krishna V,Able to add the same bank accounts multiple times
12-02-2022 09:08,"I’ve used PhonePe and it’s competitors for the past 5 years now, and I can safely say hand down PhonePe is the fastest, easiest and has the least failure rate (I’m looking at you Gpay) 

Keep it up!",5,FALSE,AakashDusane,The best UPI app by far
27-07-2022 11:57,Why this app don’t have history delete option ? There should be delete option.,4,FALSE,Girigadu6,Delete Option for History
25-07-2022 14:13,"I added  money in my phonePe wallet now i can’t use it to pay to merchants and evem I can’t transfer money back to my account. While i am trying to deactivate my account permanently they are saying you have to withdraw all amount from phonepe wallet but they are not giving option for withdrawing. So i request you all to please don’t download rather than this use BHIM, GooglePay amd Paytm.",1,FALSE,travelholic29,Vey bad experience
23-06-2022 15:19,"My money is stuck in wallet. I can’t transfer that money to my bank account or I can’t pay my bills too.
Can you let me know the list of merchants available on switch platform that you told me to use to utilize my wallet money which I can no use anywhere else. Otherwise its useless app. And pathetic experience. 
This app is not worthy of one star also",1,TRUE,prashant_hanu,Useless app
26-03-2022 10:49,I am not able to view most of my contacts after the update. I have to manually type the number which is already saved in my contact. Not able to pay LIC premium. The problem is in iPhone app,2,FALSE,subu55,Contacts not showing after update
13-09-2022 13:33,Far better tha other other pay app specially from google pay they always have server problem.,5,FALSE,rachit shrivastava,Nice app
27-11-2022 03:43,"NEVER buy any mutual funds in PhonePe. Their KYC can go wrong any time and then our money is stuck. We can raise ickets but it takes eons for getting a response. They are good for money transfer, pleas just do that and go for other options for investments. Writing my pain point here, thinkng it may help some new users. Thanks!",2,FALSE,PrabhuSRG,NEVER Buy any Mutual Funds
21-07-2022 11:19,It’s not support in iOS 12 so change in the supporting device list.,5,FALSE,hdjdkksjbd,Change supporting device list
01-06-2022 19:31,"A widget as shortcut for quick payment should be available for ios.
Paytm has already rolled this a long back.",5,FALSE,debipaikaray,Widget for iPhone is needed
04-04-2022 06:24,"Goood going till date , kindly make options to see bank statement for all the linked accounts not only for single . & rest is okkeep it u in bussiness and work",5,FALSE,malhotrabuilders,Bussiness
09-03-2022 15:17,Compared to other phone pay is really reliable and efficient working app,5,FALSE,ammu2329,Fast transaction app
24-03-2022 07:03,"As checked , PhonePe customers are not  varified customer , phonepe is cheating and stealing money as twice my money got deducted from my account , even I am not getting 0 star option for PhonePe rating because phonepe deserve that only.
Even I did not get option for chat in phonepe and also did not option to transfer the call to officer.
#Pathetic service
#fraud application
#Fake",1,FALSE,Hare Madhav,PhonePe is Fraud application
16-02-2022 02:21,If some time use other app payment then PhonePe send one msg for customers you’re payment will be debit that’s I like too much shortly I spiked to all use PhonePe only,5,FALSE,lata uhar,For payment
23-02-2022 09:57,I am very unhappy about phone pay system Google pay is better than you they didn’t debit money from account if technical issues is there and phone pay first of all deduct money and then tell us Technical issue is there and your money is safe ..   my transiction is in processing in last 28 hours didnt solve my problem,1,FALSE,rupspatil,Payment processing
24-01-2022 04:58,Every time my number is asking to sign in repeatedly why this is happening,5,FALSE,venky168368637,Dissatisfied about re signing every time
10-09-2022 13:33,Now a day PhonePe is become like a bank account so I request to apps developer to add write narration column so that in bank statement and PhonePe statement easily we can see to whom we send the money,5,FALSE,Zafer hassan,Narration
02-10-2022 10:36,Never buy a insurance from this app it’s totally fake..I purchased the insurance with the comprehensive cover for one year but they provide me only third party…another thing is u can’t do anything about it after purchase the customer support agent will not  there on the second attempt neither they proceed your inquiry which is ticket id..I’m going to stop using this app,1,FALSE,karmu 007,Fraud insurance
28-07-2022 14:49,Good shop .. all phone service done inclusive laptop and is also ..clear shop available 24 hrs (home ),5,FALSE,farook@,Excellent service
08-03-2022 14:07,My 20k is stuck since 15 days and phonepe is telling to contact bank and bank says to contact phonepe I am not getting any proper solution,5,FALSE,akkadbalkad,Bad service
25-01-2022 07:44,Pathetic service I have done a transaction of credit card bill payment and the amount is processing from 1hr nd amount has also been deposited from my account nd it’s always creat trouble while I have to do some urgent transaction .. such a pathetic service it’s better to use google pay and Paytm will never recommend to use this app,1,FALSE,rasshhhuuu,Transaction pending
14-12-2022 05:20,"Very safe and instant medium of transaction, save time and helps to track expenditure which is very good feature.. till now no issues faced",5,FALSE,Bhaskar durgesh,Financial app
20-09-2022 12:06,As I already complained in phonepe app but awaiting for solution for the same .,5,FALSE,punit k patel,Contact not showing @ To mobile number section
07-11-2022 19:19,"While sending money I got message of technical issue more than 5-6 times during urgency. Then what does it mean when we talk about 24*7 online banking? Harassing most of the time!

Adding one more …thing its started taking commission for mobile recharge in the era of 5G.

I would suggest stop being a company of multi brand ambassador rather extend your services to the common man. A good review from common man like me should be valuable than the advertisement on tv.

But I hope neither my review nor my suggestion matters for you. Because you people understand the market differently and will do what you want to.",1,TRUE,007jayeshraj,Not recommendable banking app
16-07-2022 09:33,"Just uninstall this app, I have added money in wallet and now I can’t use this amount any where like electricity bill, mobile recharge, or even I can’t buy Netflix plan even if I want to pay for groceries I can pay from wallet all the time this app is saying pay from bank account, worst wallet feature I have ever seen",1,FALSE,priyank acharya453,Worst wallet feature
06-07-2022 12:17,"Please add an option to delete messages from the chat history, it will be more convenient for the users to use it without any hesitation, fear or worry.",4,FALSE,fatima moosvi,Messages
11-04-2022 09:22,Why that much frequent update! It seems like it is along for updates one to two times per week!!,4,FALSE,there is no use at all,Why that much frequent updates!
18-09-2022 06:59,"I am not able to pay from my wallet. Every time I try it sends me to my bank account
.Thanks",5,FALSE,pinakkumkum,Problem
29-07-2022 04:48,Transaction is fast and easy for now person,5,FALSE,mvbchary,Transaction is fast and easy for now person
23-03-2022 16:23,"Using from last 3 years ,awesome experience just cash back and offers shared is not benefiting…
Transactions are smooth though",5,FALSE,Hemant-143,Awesome
09-02-2022 12:51,Very useful and quick app... Never experienced any delay or failure of payment. Using it from almost more than 2 years.,5,FALSE,Rahoolrd,Excellent App
29-01-2022 16:00,Very quick and easy to transfer the money and pay bills,5,FALSE,kalpanasiddappa,Best app for online payment
29-01-2022 10:45,While making payment there has to be an option to ask for confirmation..on adding password the amount directly gets deducted instead of asking again to confirm the payment process,2,FALSE,Manu BV,No confirmation asked
15-01-2022 04:07,"This is very surprising that a firm like PhonePe cheats its Cx like this.
They block Cx account without any prior information and then keep it blocked for good one week.
My account is still blocked and the response from their Cx Support team is pathetic without any support. There is no TAT for closure of the tickets, supervisor is not available on call, they don’t call back at preferred time and provide fake commitment on each and every ticket and issue.

My account has been blocked because, I purchased gold from them and wanted to sell it post 24 hours.
It seems that this is an ongoing issue with other Cx’s as well..
PhonePe needs to fix it",1,FALSE,vivkd796,Fraud app
21-12-2022 09:08,Better to transfer an amount,5,FALSE,being arbaas,Money transfer
16-09-2022 12:52,It will be great if you could just add Paytm like widget which directly opens UPI payment interface. It is the only reason why I use Paytm as my go to UPI payment app.,5,FALSE,Sattu👍🏼,Need a little widget
21-11-2022 13:53,"Very unfortunate service
Receiver refused to give money back. Thank you for kind support for loosing my 1900 rs loss. Just gone uninstall the application. Never gona use phone pay again in my entire life. Thank you for your copy paste responses it helped me alot to loose money. Hope this will not happen with some other user",1,FALSE,dhsnxdn,This was my last reply to phonepay support team
24-09-2022 13:10,They don’t support any transaction older than 30 days and they treat the brand voucher sold as transaction but not as product . if you have any issues while using the voucher(which have 1 yr validity) they simply say since the transaction is older than 30 days we cannot do anything check with the bank,1,FALSE,Sdev89,Don’t buy brand vouchers
13-07-2022 11:26,"Its been over week and my issue is not yet solved and no one is giving me any sign of refund my family is very worried about the amount , i paid and electricity bill on this application and phonepe deducted the money and still not showing on merchants account moreover phonepe is not showing me any sign of my refund",1,FALSE,ROHIT KUMAR CHOUHAN,"Poor services my amount of Rs 2,200,22/- is still not solved"
27-02-2022 19:43,Suddenly most of the transaction history disappeared. I checked with all filters and done with clear filter still most of my transaction is missing…,3,FALSE,Verizon M,Transaction History Missing
24-11-2022 12:46,The auto guys in bangalore recommended this as a better option to gpay. They were right.,5,FALSE,kapilan96,Better than gpay
03-04-2022 07:28,"Excellent process of transaction,with a one click payment done.",5,FALSE,Dipakkumar Shah,Card Payment
05-03-2022 05:51,"Promotion coupons not provide 
Only cash back coupons provided",5,FALSE,jhashab,Complain
27-02-2022 05:30,#NAME?,5,FALSE,Altáïr,Additional- App improvement
15-01-2022 18:29,Why everyday we shud update the app why can’t you have a frequency like monthly r quarterly once?,5,FALSE,KKKumarrrr,Everyday we need to update app while using
17-10-2022 12:39,One should be able to transfer payment ONLY AND ONLY if that ( the receiver’s ) mobile no is using the app currently and not if he used it once and deleted it .,3,FALSE,App Well wisher,Amount Debited from my account but not seen in vendors Account
03-12-2022 13:58,Yours phone pay offers and rewards are waste please try to give cash back to improve you service and you are charging extra for recharges and credit card payment also,2,FALSE,its imp,Important information
06-11-2022 18:23,I made a donation for a cause listed on PhonePe and only after receiving the email I came to know about the misleading information. Give India NGO is getting 10% of the donation as charges. This is mentioned inside faq but not in the main page. This is clearly misleading on purpose. I would have directly donated to the NGO if I knew this before. Unethical!!!,1,FALSE,sathsham,Misleading donations section! Donate directly!
01-10-2022 16:31,When i am going to pay someone I searched in contact that person not showing on list which I already pay before. And also when i pay just enter by number that’s name not showing on list. This bug appears after I updated,1,FALSE,Salman.sallu,Contacts not showing properly
