date,review,rating,isEdited,userName,title
07-06-2019 02:29,"Please add a moving logo in the payment confirmation screen, . The shopkeepers are not able to recognize if it is a screenshot or the real one. Please fix this by adding a moving logo after a successful payment so that the people can see it moving and know it is not a screenshot. I hope you got what I meant to say. Please fix this. This is not only an issue with me. Its an issue for many. And this is an issue only with PhonePe. Please do something as this makes it really miserable after payment.",1,FALSE,Dr Sajin,Please add something moving in the payment receipt
25-02-2019 20:30,"Dear team, this app was working tremendously with voice-over in previous version but now this app has become very inaccessible with voice over specially the  fun transfer menu which is not accessible with voice-over. Plz fix it as soon as possible.",5,FALSE,bhim28,Voice over accessibility
26-11-2019 16:42,"This app has the worst customer service you can ever get! They don’t reply on time and they never understands your complaints. I have a query pending since 30th Oct for a cashback that they didn’t give for an eligible transaction. Till date I’ve got no response from them even tho

Special mention of Mr Santosh who is the most useless floor supervisor you’ll come across. He asks the same questions 5 times and still is unable to provide any resolution. I’ve been so mentally harassed by them that I’m going to take the case to consumer court!",1,FALSE,Pr Dang,Do not fall in their trap!
06-09-2019 04:53,I am using phone from 1 year its a great experience with phone pay but cashback reward was good i use my cash back in phone recharge but now they provide vouchers which are use less for me cashback can be use any while shopping online but vouchers bound us to use the apps but still PhonePe is good no other issue happened during transaction,4,FALSE,khushi-kuhu,Great experience
31-07-2019 15:28,I’m unable to log in. App says account blocked. Been trying to call customer care since last hour and it says all the executives are busy and disconnects the call asking to complain through app. Tried that and it takes ages to get otp and once entered it doesn’t process. I don’t have a reason to not delete the app.,4,FALSE,hassansharief76,Poor customer care
08-11-2019 02:18,This is more of an app feed back. While making the payment through debit and credit card the app should integrate with Sms app on iphone/ iOS and allow the app to read the OTP and proceed... this feature is very small but very useful and important. For me it is a differential experience vs other wallets,5,FALSE,Sethisanj,OTP on Sms integration
26-06-2019 13:22,"I kept hearing about this app since a very long time. But didn’t even thought of downloading It. After using many friendly payment apps, I was vexed up with pending processing status, especially @ upi Payments, but I was really impressed the way this app is working at all segments. Guys.. go for it.. Ul love it..😊",5,FALSE,Nakshatra28,Perfect Payment App
17-02-2019 06:57,My all the friends get good cashback when they use this app but I always see “better luck next time “ so I would like to stop using this app. I think Freecharge would be better option.,5,FALSE,shokey2018,Mostly I use this app but don’t get cash back even my friends get it most of the times
03-11-2019 17:01,One of the amazing features ...especially the payment pending reminder works so amazing without even opening shortcut app! As if it’s integrated into the system...but UI can be updated into material design or like other and can be integrated to send payments through Siri and dark mode,5,FALSE,karthik.yn bharadwaj,Siri Shortcuts
29-09-2019 17:47,"Poor service. 
KYC points haven’t been updated as per the location but limited access has been declared before that. You should have made the KYC points available to the consumers first. Even after that if they don’t update KYC then limited access to PhonePe must be honoured to the customer.",5,FALSE,Aparna sakhare,KYC UPDATE TAKING TOO LONG
21-01-2019 22:09,"After the resent update,the feature to change the default bank for receiving the payments is missing....could you please help me how do I change the default bank for receiving in womhicj the money I receive from my friends is to be credited...

Let me explain you I detail...
I have three bank accounts linked to my phonepe account....I have account A as default and when a frnd of mine sends money to my phonepe mobile number, the money gets credited to bank account A...
How do I change it to bank account B...

Please reply soon....🙆🏻‍♂️🙆🏻‍♂️",5,FALSE,phanisai2907,Unable to change the default bank
19-06-2019 03:54,Dear PhonePe customer please help me my wallet is black around six months back please help us me it is and black wallet PhonePe is very good but why is the giving of this kind ofCan you please help us me I can install many time I can call the customer care but they will told Helpless worlds someone please help me how it is open to Wallet unlock,5,FALSE,manjunath h,Wallet is blocked
20-02-2019 16:52,"After using phonepe app I uninstalled all my payment apps.. bqz i just love this app amd love to use it.. but the problem is whenever i try to Withdraw my wallet balance which i get from cashback and rewords it say i have to complete kyc.. but I already done the kyc procedures that the app has.. so please fix this problem as soon as possible.. 
THANK YOU",4,FALSE,Dev Raj Ghosh,Love this app.. but need some change
15-11-2019 11:21,"Hii 
I have update phone pe application and after update I’m unable to login in my phone pe account so I would request you please suggest me how can I login again. 
When I tried to login in my phonepe its showing something went wrong try again letter.",5,FALSE,jai solanki,Unable to login after update
06-08-2019 03:41,this app will just hold your money don't use this app. i have payed for my credit card payment but they didn't sent money to bank USELESS APP now i have to pay extra for late fee. don't use this app. I m feeling like someone taken my money and ran away 😡😡😡😡i will rate this app as 0 star,5,FALSE,jasspi malhi,useless app
16-10-2019 04:39,"normally app works fine but when i try to send to some contact by clicking on To Contact button app getting dead slower and on typing 2 digits of mobile number to search, app was not working at all. tried with good internet connectivity.",4,FALSE,Rammohana rao,App was getting struck for sometime when clicking on to contact
08-01-2019 07:39,"I recently i have initiate a mobile recharj , money is deducted from my phonepay wallet , still my recharj showing in processing for more than 1 hour , so i requested to cancel this order because i have alredy recharjed from other application , they responded that we didnt get money from bank , while i have selected payment from wallet , and tell me to wait for 2 days after that they will recharj what to do with that recharj after 2 days . I want my money back",2,FALSE,Pooja Arora,Problem occured
01-01-2019 06:45,I booked a ticket in bookmyshow using phonepe...I din get my ticket and my money was deducted ...when I raised a case they are not giving any clarity whether I will get my ticket or not...they don’t even refund my amount even when they are not able to provide me my ticket...without all these information why do you provide option to book from the app .....worst customer care service....I have never reviewed any before but this is first time since they are cheating very badly and have very poor service,1,FALSE,anonymous2694,Worst customer care
21-10-2019 09:59,World worst app it make payment without OTP today it paid my electricity bill automatically I didn’t get any OTP or any other confirmation to pay there was some problem with my bill that’s why I don’t want to pay it but now i get msg of dedication pf payment from my bank,5,FALSE,rohit turan,Payment without OTP
07-01-2019 18:27,"I was very satisfied with this kind of app
And request other friends to take the advantage of some good refund amount in today’s hard days which is made Happy by this app offering back
Thanks to the team India and thanks to Phone pay 👍....🙏",5,FALSE,Dhaniyabhai,Thanks to phone pay It is very easy it I tried
03-10-2019 09:09,No response from customer care... worst very worst... my transaction is pending for past 3 days...am unable to contact customer... only message option is given for customers to contact with phonepe customer care... But no response...,5,FALSE,Prasad G 1234556,Worst app.. Unable to contact customer care...
02-08-2019 00:54,"From yesterday to today the security reasons ( let's assume there are some), I have been logged out now & then & been asked for password. Now it says unable to login even after providing password. Please do something so that I can use the app!",5,FALSE,ShibuPhonepe,Unable to login
17-05-2019 19:48,"Hi,

I like your app and service. This is awesome app. I’m doing almost all my transactions from this app. 
But I was expecting something feature like monthly/weekly expenses report so I can control my extra expense. Looking forward to see this feature. Thnaks!",5,FALSE,Omkar Sagare,Good service but expecting monthly expenses report
12-01-2019 07:32,"Useless Customer support service and there will be No cash back as they mention, it’s all trap to the people, please don’t believe the Ads and don’t use this useless one. They don’t know what is happening with the app also, no knowledge of the issues to the Customer care people",5,FALSE,Fire Brand Person,Cheating App
03-01-2019 15:51,Tried transferring money using upi transfer but don’t see any scratch card. Its Same for my wife.  Wasted half an hour just exploring here and there. Making fool by just promoting false advertisement.  Google pay is easy to use and immediate scratch card. No hidden thing.,5,FALSE,$unil$@hu,No scratch card
12-04-2019 11:12,"When we rise a issue they do not respond properly and if we raise a ticket they will close it and say resolved without intimating us or without solving it..
 Don’t book through app provided in PhonePe app, the order won’t be successful placed and they delay in refunding the amount.",5,FALSE,K J .,Worst customer care support
25-11-2019 03:42,There is some problems like payment failed or transaction pending sudden starts 2 or 3 months ago till now..... but I use phone pay since 2 years and this is a very good and easy app to use,5,FALSE,rahul04sept@,Payment issues since 2 month
05-10-2019 06:45,"Every time i make payment it asks for cvv and otp why is it so?
earlieer it was not asking for it again and again we just have to give upi pin thats it and payment was completed but in new build it is difficult to make payment",5,FALSE,Important500,Asking CVV and OTP in every payment why?
15-11-2019 10:45,"Hello, 
I have some issues with app. It is not allowing me to sign in with my mobile number and password. I uninstalled and then reinstalled in my iPhone. But still same issue. Do something.",5,FALSE,drnareshm,Not able to sign in
26-02-2019 16:44,I have been noticing this from quite a time after your recent updates. There is no option to change your primary account no. or add new bank account. Please look into it.,5,FALSE,vishsquare,Huge Bug or mistake in the application.
09-03-2019 06:38,I usually don’t write a review but PhonePe has not left me no choice I have been facing problems of refund it’s been more then a month now the customer care gives the wrong information. when ever I call the customer care they say only this” You will receive your refund in next to 3-5 days”Very bad experience to be honest I will recommend anybody to download PhonePe.,3,FALSE,Prekshitha Masthare,Refund issues
06-02-2019 18:15,"After the recent update the app became tooo slow that i cant even transfer the money and receive also. Fix the issue as soon as possible. 
I checked with other app there is no issue with my internet.",5,FALSE,maddy0224,Worst update
23-05-2019 17:55,They just blame the bank for the failed transaction and keep the money for 7-9 days and earn the interest over it. Just think if the bank release the amount from the account then how its mistake from the bank? And where is this amount parked? And just if the debit can be done just in seconds why the refund takes 7-9 days? Why the reconciliation process so long? Just think if the amount debited is too large who will pay for the interest loses of the customer?,1,TRUE,5zee,Fraud App
02-02-2019 14:09,"Please don’t use this app guys.
The developers are openly cheating in this app and the reason is, you can’t use your own wallet in which your money / amount is credited.
Developers are clearly mentioning that once the wallet is deactivated, they will never reactivate it back.
And the money/amount which is credited into your PhonePe wallet are going to get lapsed and you will have no option rather than to delete this app.
And the transactions made are completely wasted.",1,FALSE,Sridhar_07,"Please don’t use this app Guys, Completely disappointing ."
20-07-2019 08:27,"one of my friend he had account in phonepay 
pay and i do payment threw mobile number and he dont recived payment because his account closed and my money is lost.

so its very bad app
do not transcition more bcz my money is lost then also happen with someone else .",5,FALSE,Iphone6s Dev,Money lost
22-01-2019 17:05,"You are just fooling public by your adds and offers that doesn’t exist. And to my surprise you don’t even allow me to raise a ticket against it. When ever I try to raise my grievance, i get into a loop and no way a complaint could be raised.",5,FALSE,ahseeris,Fooling people in the name of referrals and cash backs
06-02-2019 17:11,"Unable to cancel train ticket also not able to connect with customer care executive , not a good option as compared with other apps , need better customer support , no one Picking call for support , think twice before making any big payment or bookings",4,FALSE,Ajit Nayak,No customer support
02-02-2019 14:50,"Worst transaction app I’ve ever seen. My amount got debited and will take 7-9 days to credit back. What kinda process is this. I’m gonna deactivate the account and inform all my friends colleagues family social media people to do the same. This happened to me and my firend at a time today. Transaction success rate is 20%. Failure rate is 80%. This has worlds worstest customer service. Whatever you reply on tickets. Only one auto copy pasted text you will get i.e, Your ticket under process.",1,FALSE,jayanthmerugumala,Very worst transaction app
16-11-2019 17:48,Faasos app inside phone does not work properly after adding items it just resets out of nowhere and I have to try again and again ....it’s been happening for past 2 months now,5,FALSE,nikssss1997,Phone pe switch apps don’t work properly
09-01-2019 06:25,"Worst application, they allow to add money into wallet but object the usage of the amount... paytm is far better than PhonePe, they have some standards and etics that they act responsible towards customers amount, but PhonePe doesn’t have minimum etics or responsibilities towards customer amount, instead they cheat the customers always",4,FALSE,SakethReddy_,Worst Application cheating customers
05-10-2019 07:54,At first it was good now it’s taking too long for money transfer and most of the time the money is debited and will not be credited to the users account after few days the money will be credited back to my account it’s a pure waste of time.,5,FALSE,Kalu_47,Bad service
02-10-2019 18:48,"I’ve completed KYC and trying to transfer wallet money to bank account but unable to do so, getting reply that I wallet money can’t be withdrawn to bank account . And I’m also not getting wallet money option while buying gold from PhonePe wallet.",5,FALSE,Altamashakhter786,Wallet Money issue
02-05-2019 10:14,Alwayz Facing Problem in transaction money block always not showing icon in iphone how many times i updates need more updates please fix it,5,FALSE,HDFC AGRA ASHISH,Alwayz Facing Problem in transaction money block always not showing icon in iphone
13-04-2019 04:35,Unable to do upi transactions post changing the phone. No response from customer support except this might be bank server issues. Not sure how they judged 4 banks servers can not have servers issue same time that too for 4 continuous days,5,FALSE,Subodhjangid,Poor customer support
08-04-2019 17:17,"My amount is blocked and no one is responding and the customer care will not care about ourselves. It is notified that transaction is successful  and also showing that the transaction is successful in the app( showing for both receiver and sender). May be this app is cheating users by holding our money for some time. As I heard from so many users that the amount is being blocked for sometime, the developers of the app are using this money and returning to users after sometime",1,FALSE,SURYA 8522823666,Worst service
20-11-2019 14:45,"Hello Tech Team #Phonepe... 
Request to Pls Re Update the app again as after the Recent Update i cannot Login after numerous tries

Giving 5 stars as i have not faced any Difficulty till date in this app
Hope this issue gets solved ASAP by Tomorrow 😊",5,FALSE,JAT pra,Login Bug ... Cant access app
01-08-2019 18:21,"Dear team, 

Since from this morning I am not able to use or do any single transaction from my PhonePe account. 

After reinstalling the app right now i am not able to login to app again. Please check what’s wrong",5,FALSE,Vinod thorwat,Not able to use PhonePe
03-10-2019 07:55,"When my friend did transaction she got it in pending and her account got debited but my account did not credit 
We are writing mails to them but there is no response from them 
Worst app we had never seen before 😡😡😡",5,FALSE,..68:89,Transaction issue
25-03-2019 13:54,"The whole pact of reaching out to the app (while minimising, ofcourse) is quite too cumbersome. It’s rather easier to direct the payment method directly to the app to key in the UPI codes for users. 
Small fix? Yes would make quite a lot of difference.",5,FALSE,AeyJayYou,Payment method too long.
02-08-2019 14:22,I am using this app since few months now. I had been loving how quick the transaction takes place. But since 2 days m unable to make the second transaction . Need to reinstall the app again to get the access. Please fix.,4,FALSE,afsan46,Need to fix some issues
25-11-2019 15:12,Phone pay advertising scratch card for every transaction but Scratch Card option is not opened even after multiple completed transaction. cheating public,5,FALSE,Manoj Vankar,False Propaganda and advertising
22-09-2019 10:23,"Helps to find out the balance easily 
Easy to transfer 
Can find names of the contacts as you have stored in your contacts.
However Cash backs and offers are less.
Overall a good app and I use it frequently",5,FALSE,timus_Sumit,Best finance app
06-07-2019 03:27,"My electricity bill is showing processing from one day before due date , and after date bill payment is show failed, than i have to pay for late fees 
Phone pe is not responsible for late fees.",5,FALSE,kalpish,Worst app for Bill payment
17-01-2019 02:27,"I’m trying to pay my electricity bill on phone pay, once I entered my account id it is showing “unable to fetch the details at the moment please try again later” I didn’t get what is happening, but the same process is happening in Paytm",4,FALSE,Anand S B,Issue on electricity bill payment
09-06-2019 10:44,"Very strange . Also I am trying to pay for Bescom bill for which I have received the hard copy , but when u log in , it is saying bill not due",5,FALSE,Tejas Chhabra,Reward points scratch card not received for Mobile Bill paid for Rs 6303 /-
16-01-2019 02:32,"You guys are encouraging people to use PhonePe through gift cards. I have used phone pe many a times and atleast 4-5 were above 10k bills payment of various kinds. YET! never got any gift cards. ""Better luck next time"" it says. well, there won't be a next time now. 

All those bogus ads showing cash back for bill payment of just ₹1000 you get ₹500 back.

Why should I take the pain to pay through your app when I can do it using my credit card directly which reflects money into metchant's account in 2 days than your platform which takes 3-7 days ? 

There is no incentive for me to use your app.",3,FALSE,Channa26,Not happy
26-04-2019 06:53,"There is no option for mobile recharge 
We can recharge only added contec only
Without saved contact number we cant recharge any mobile ,add option can direct recharge without save number",5,FALSE,AFRIDI MOBILE,Mobile recharge
18-05-2019 14:03,Worst app I would Request you to boycott phone pay app... I informed my family and all friends not to use the phone pay app.. I guess the management is couch potatoes and management needs to be change because this all people are making us fool by comparing with google pay... which you won't to be able to stand next to google pay... I guess management should get fire as they are sallowing money from us...,1,FALSE,Rakesh Manna,Worst app it's better to use google pay
12-01-2019 05:06,Wrost for bills payment updates. 5days for updating my money to my utilities. Who they help you are to hold my money. Better I will use other apps. It will update in two days.,5,FALSE,Shiva N D,Unhappy of your service
01-01-2019 07:24,So poor service my bank account deducted money and transaction fail showing phone pay app and second thing customer care doesn’t received call,5,FALSE,jjajhehd,Poor service
23-12-2019 16:02,When I click to money transfers to contacts my phone gets freeze completely. Need to restart the app but the issue continues. Plz check,5,FALSE,Sureshchoudhary1406,Problem with money transfers to contacts
01-11-2019 04:11,"Showing in valid PhonePe mobile number in contact list which has no beneficiary but amount has been deducted after sending. No response from customer support, never expected this from PhonePe....",5,FALSE,sai7kiran8,Looting
05-06-2019 13:43,TBH The offers I’m getting is kind off waste. I’m getting offers on Oyo hotels! Which apparently most of the people never use it! We would like to get the amount rewards rather than these offers!,5,FALSE,rahul thejas,Rather I use Google Pay
27-07-2019 16:09,"Really liked this app but there is no feature for filtering user in recent transactions screen. Currently user can only filter on the basis of category, month and etc. But if user wants to see how many transactions he has done with a particular user then app will say NO. Pls look into this concern",3,FALSE,Shashanka Shekhar,Nice application but need some more feature
02-04-2019 09:17,"Hi all, 
I am facing much trouble due to I made my credit card bill through Phonepe...
Don’t make any credit cad bill through Phonepe because it is not reflecting in Card. This a great worst app and worst staff",5,FALSE,Niranjankrishna,Never pay Credit Card payments through Phonepe
13-03-2019 15:53,"Hi,
      Everytime when i proceed payment through phonepe its processing the transaction and payment is successful too... But when later it shows payment failure or technical issue occured... But amount will be deducted and reverted back within 7 days.. can you kindly check the issue and resolve it..
Thank you,",3,FALSE,Geethsss,Payment successful but not processed further always
04-03-2019 13:39,"I am having multiple bank accounts so if I have to check balance in all bank accounts then I have to click bank balance everytime, earlier it was on a single view which was too easy to check balance, now I have to follow a long procedure to check bank balance. Kindly revert this feature as soon as possible.",2,FALSE,Ravi_iOS_Developer,Worst bank balance user interface
08-03-2019 18:28,"I have been using PhonePe quite some time already and I have suggested several times to introduce  KYC facility and add money to wallet by credit card facility, however these aren’t available as of now. When I am able to pay for all services by a credit card, then why not add money to the wallet and pay it off at my convenience. 

I will be forced to use other wallets instead of PhonePe if this continues.",1,FALSE,Psroy,Full KYC and add money to wallet by credit card unavailable
02-02-2019 12:01,"I am using this phonepe for more than 2 year. Failure in transaction is happening frequently and helping from the back-end customer is very bad. They make the call on hold for 10 mins and make it cut automatically.. . Actual issue with the App. All my colleagues faced this on that time. Even can't able to check balances also....!!! 
If any maintenance issues is there why can't you people send a server maintenance notification via app???",1,FALSE,Amal Darsan,Bad backend support
12-01-2019 04:25,"Worst app how bold this app he doesn’t have make sense to how to build a app once wallet closed you won’t get your wallet money and your wallet reactivation 
It’s really worst experience in my life I lose more they 400rs because this app I should never use this app and I should not recommend to anyone",4,FALSE,sandhani,Worst Wallet service
01-01-2019 13:04,"Sometimes, the payments do not go through, particularly credit card payments. It is high time you bring Master Cards also under your purview.",5,FALSE,Murnar,Difficulties in making payment
15-09-2019 02:43,"Dear Team,
i have used this app on apple 4s till now i didnot get any app update and when i was used transactions in this app i didnot recieve any cash back from them is there any problem please update as early as possible",5,FALSE,Vamsi Gampa,phonepe update
